source,text,created_at,retweet_count,favorite_count,time,date,Date,Open,High,Low,Close,Adj Close,Volume,diff,label
Twitter for iPhone,I will be announcing my Second Term Presidential Run with First Lady Melania Vice President Mike Pence and Second Lady Karen Pence on June 18th in Orlando Florida at the 20000 seat Amway Center. Join us for this Historic Rally! Tickets: https://t.co/1krDP2oQvG,05-31-2019 20:35:41,35248,128039,2019-05-31 20:35:41,2019-05-31,2019-05-31,2766.149902,2768.97998,2750.52002,2752.060059,2752.060059,3981020000,-14.0898430000002,0
Twitter Media Studio,GREAT NEWS! #MAGA https://t.co/91Yk8B11bP,05-31-2019 20:02:16,20493,75339,2019-05-31 20:02:16,2019-05-31,2019-05-31,2766.149902,2768.97998,2750.52002,2752.060059,2752.060059,3981020000,-14.0898430000002,0
Twitter for iPhone,As we celebrate LGBT Pride Month and recognize the outstanding contributions LGBT people have made to our great Nation let us also stand in solidarity with the many LGBT people who live in dozens of countries worldwide that punish imprison or even execute individuals....,05-31-2019 19:12:32,28936,136614,2019-05-31 19:12:32,2019-05-31,2019-05-31,2766.149902,2768.97998,2750.52002,2752.060059,2752.060059,3981020000,-14.0898430000002,0
Twitter for iPhone,....on the basis of their sexual orientation. My Administration has launched a global campaign to decriminalize homosexuality and invite all nations to join us in this effort!,05-31-2019 19:12:32,20416,105421,2019-05-31 19:12:32,2019-05-31,2019-05-31,2766.149902,2768.97998,2750.52002,2752.060059,2752.060059,3981020000,-14.0898430000002,0
Twitter for iPhone,.@SeanHannity is having a DEEP STATE SHOW tonight on Fox News at 9:00 PM (E) exposing the tremendous abuse of power that has been uncovered. Tremendous guests a must see – Enjoy!,05-31-2019 18:11:25,18257,65602,2019-05-31 18:11:25,2019-05-31,2019-05-31,2766.149902,2768.97998,2750.52002,2752.060059,2752.060059,3981020000,-14.0898430000002,0
Twitter for iPhone,Saddened to hear about the loss of John Pinto a Navajo Code Talker in World War II over the Memorial Day Weekend. The Code Talkers are true American HEROES and John never stopped serving his fellow citizens as a longtime New Mexico State Senator. John Rest In Peace!,05-31-2019 18:08:33,15507,70626,2019-05-31 18:08:33,2019-05-31,2019-05-31,2766.149902,2768.97998,2750.52002,2752.060059,2752.060059,3981020000,-14.0898430000002,0
Twitter for iPhone,90% of the Drugs coming into the United States come through Mexico &amp; our Southern Border. 80000 people died last year 1000000 people ruined. This has gone on for many years &amp; nothing has been done about it. We have a 100 Billion Dollar Trade Deficit with Mexico. It’s time!,05-31-2019 14:41:24,28966,108484,2019-05-31 14:41:24,2019-05-31,2019-05-31,2766.149902,2768.97998,2750.52002,2752.060059,2752.060059,3981020000,-14.0898430000002,0
Twitter for iPhone,In order not to pay Tariffs if they start rising companies will leave Mexico which has taken 30% of our Auto Industry and come back home to the USA. Mexico must take back their country from the drug lords and cartels. The Tariff is about stopping drugs as well as illegals!,05-31-2019 14:27:51,23038,92471,2019-05-31 14:27:51,2019-05-31,2019-05-31,2766.149902,2768.97998,2750.52002,2752.060059,2752.060059,3981020000,-14.0898430000002,0
Twitter for iPhone,Mexico has taken advantage of the United States for decades. Because of the Dems our Immigration Laws are BAD. Mexico makes a FORTUNE from the U.S. have for decades they can easily fix this problem. Time for them to finally do what must be done!,05-31-2019 13:30:29,21997,91207,2019-05-31 13:30:29,2019-05-31,2019-05-31,2766.149902,2768.97998,2750.52002,2752.060059,2752.060059,3981020000,-14.0898430000002,0
Twitter for iPhone,Hard to believe that with the Crisis on the Border the Dems won’t do the quick and easy fix. Would solve the problem but they want Open Borders which equals crime!,05-31-2019 13:14:26,19344,80583,2019-05-31 13:14:26,2019-05-31,2019-05-31,2766.149902,2768.97998,2750.52002,2752.060059,2752.060059,3981020000,-14.0898430000002,0
Twitter for iPhone,Congratulations to the @AF_Academy Class of 2019! https://t.co/A4Rxd1BsVn,05-31-2019 12:51:10,14530,68749,2019-05-31 12:51:10,2019-05-31,2019-05-31,2766.149902,2768.97998,2750.52002,2752.060059,2752.060059,3981020000,-14.0898430000002,0
Twitter for iPhone,Sean Davis The Federalist: “Mueller proved his entire operation was a political hit job. Still ZERO evidence of Trump-Russia Collusion and no new evidence from Mueller.”  @TuckerCarlson @FoxNews,05-31-2019 12:38:16,15099,57963,2019-05-31 12:38:16,2019-05-31,2019-05-31,2766.149902,2768.97998,2750.52002,2752.060059,2752.060059,3981020000,-14.0898430000002,0
Twitter for iPhone,I will be watching @AlanDersh on @IngrahamAngle at 10:00 P.M. He speaks the truth!,05-31-2019 01:52:12,10076,51077,2019-05-31 01:52:12,2019-05-31,2019-05-31,2766.149902,2768.97998,2750.52002,2752.060059,2752.060059,3981020000,-14.0898430000002,0
Twitter for iPhone,....at which time the Tariffs will be removed. Details from the White House to follow.,05-30-2019 23:30:20,19950,100406,2019-05-30 23:30:20,2019-05-30,2019-05-30,2786.939941,2799.0,2776.73999,2788.860107,2788.860107,3273790000,1.920165999999881,1
Twitter for iPhone,On June 10th the United States will impose a 5% Tariff on all goods coming into our Country from Mexico until such time as illegal migrants coming through Mexico and into our Country STOP. The Tariff will gradually increase until the Illegal Immigration problem is remedied..,05-30-2019 23:30:19,39564,162037,2019-05-30 23:30:19,2019-05-30,2019-05-30,2786.939941,2799.0,2776.73999,2788.860107,2788.860107,3273790000,1.920165999999881,1
Twitter for iPhone,The Navy put out a disclaimer on the McCain story. Looks like the story was an exaggeration or even Fake News - but why not everything else is!,05-30-2019 22:23:21,21757,86671,2019-05-30 22:23:21,2019-05-30,2019-05-30,2786.939941,2799.0,2776.73999,2788.860107,2788.860107,3273790000,1.920165999999881,1
Twitter for iPhone,Yesterday Border Patrol agents apprehended the largest group of illegal aliens ever: 1036 people who illegally crossed the border in El Paso around 4am. Democrats need to stand by our incredible Border Patrol and finally fix the loopholes at our Border! https://t.co/6K1rIUzorM,05-30-2019 21:16:00,36539,108584,2019-05-30 21:16:00,2019-05-30,2019-05-30,2786.939941,2799.0,2776.73999,2788.860107,2788.860107,3273790000,1.920165999999881,1
Twitter for iPhone,Just arrived in Colorado. Getting ready to deliver the commencement speech at the Air Force Academy graduation. Very exciting - probably will be broadcast live on TV. They want good ratings!,05-30-2019 16:30:01,13799,75250,2019-05-30 16:30:01,2019-05-30,2019-05-30,2786.939941,2799.0,2776.73999,2788.860107,2788.860107,3273790000,1.920165999999881,1
Twitter for iPhone,https://t.co/J80cxMYVDX,05-30-2019 16:28:40,20614,84931,2019-05-30 16:28:40,2019-05-30,2019-05-30,2786.939941,2799.0,2776.73999,2788.860107,2788.860107,3273790000,1.920165999999881,1
Twitter for iPhone,Very sad to hear the news on the passing of my friend Senator Thad Cochran. He was a real Senator with incredible values - even flew back to Senate from Mississippi for important Healthcare Vote when he was desperately ill. Thad never let our Country (or me) down!,05-30-2019 16:27:19,16341,88356,2019-05-30 16:27:19,2019-05-30,2019-05-30,2786.939941,2799.0,2776.73999,2788.860107,2788.860107,3273790000,1.920165999999881,1
Twitter for iPhone,Robert Mueller came to the Oval Office (along with other potential candidates) seeking to be named the Director of the FBI. He had already been in that position for 12 years I told him NO. The next day he was named Special Counsel - A total Conflict of Interest. NICE!,05-30-2019 15:34:11,27263,100744,2019-05-30 15:34:11,2019-05-30,2019-05-30,2786.939941,2799.0,2776.73999,2788.860107,2788.860107,3273790000,1.920165999999881,1
Twitter for iPhone,“Comey and Brennan are turning on each other.”  @kilmeade,05-30-2019 14:41:24,15404,66131,2019-05-30 14:41:24,2019-05-30,2019-05-30,2786.939941,2799.0,2776.73999,2788.860107,2788.860107,3273790000,1.920165999999881,1
Twitter for iPhone,Congressman John Ratcliffe “The Trump Campaign clearly did not conspire or collude.” @FoxNews,05-30-2019 13:41:43,14414,64132,2019-05-30 13:41:43,2019-05-30,2019-05-30,2786.939941,2799.0,2776.73999,2788.860107,2788.860107,3273790000,1.920165999999881,1
Twitter for iPhone,Russia Russia Russia! That’s all you heard at the beginning of this Witch Hunt Hoax...And now Russia has disappeared because I had nothing to do with Russia helping me to get elected. It was a crime that didn’t exist. So now the Dems and their partner the Fake News Media.....,05-30-2019 11:57:47,27060,117745,2019-05-30 11:57:47,2019-05-30,2019-05-30,2786.939941,2799.0,2776.73999,2788.860107,2788.860107,3273790000,1.920165999999881,1
Twitter for iPhone,....say he fought back against this phony crime that didn’t exist this horrendous false accusation and he shouldn’t fight back he should just sit back and take it. Could this be Obstruction? No Mueller didn’t find Obstruction either. Presidential Harassment!,05-30-2019 11:57:47,22146,103966,2019-05-30 11:57:47,2019-05-30,2019-05-30,2786.939941,2799.0,2776.73999,2788.860107,2788.860107,3273790000,1.920165999999881,1
Twitter for iPhone,Russia Russia Russia! That’s all you heard at the beginning of this Witch Hunt Hoax...And now Russia has disappeared because I had nothing to do with Russia helping me to get elected. It was a crime that didn’t exist. So now the Dems and their partner the Fake News Media.....,05-30-2019 11:38:15,3073,11986,2019-05-30 11:38:15,2019-05-30,2019-05-30,2786.939941,2799.0,2776.73999,2788.860107,2788.860107,3273790000,1.920165999999881,1
Twitter for iPhone,....say he fought back against this phony crime that didn’t exist this horrendous false acquisition and he shouldn’t fight back he should just sit back and take it. Could this be Obstruction? No Mueller didn’t find Obstruction either. Presidential Harassment!,05-30-2019 11:38:15,2974,11719,2019-05-30 11:38:15,2019-05-30,2019-05-30,2786.939941,2799.0,2776.73999,2788.860107,2788.860107,3273790000,1.920165999999881,1
Twitter for iPhone,The Greatest Presidential Harassment in history. After spending $40000000 over two dark years with unlimited access people resources and cooperation highly conflicted Robert Mueller would have brought charges if he had ANYTHING but there were no charges to bring!,05-30-2019 11:21:45,24940,101898,2019-05-30 11:21:45,2019-05-30,2019-05-30,2786.939941,2799.0,2776.73999,2788.860107,2788.860107,3273790000,1.920165999999881,1
Twitter for iPhone,I was not informed about anything having to do with the Navy Ship USS John S. McCain during my recent visit to Japan. Nevertheless @FLOTUS and I loved being with our great Military Men and Women - what a spectacular job they do!,05-30-2019 00:59:43,20133,98221,2019-05-30 00:59:43,2019-05-30,2019-05-30,2786.939941,2799.0,2776.73999,2788.860107,2788.860107,3273790000,1.920165999999881,1
Twitter for iPhone,Great show tonight @seanhannity you really get it (9:00 P.M. @FoxNews) that’s why you’re Number One (by far)! Also please tell Mark Levin congrats on having the Number One book!,05-30-2019 00:46:39,15457,70638,2019-05-30 00:46:39,2019-05-30,2019-05-30,2786.939941,2799.0,2776.73999,2788.860107,2788.860107,3273790000,1.920165999999881,1
Twitter for iPhone,How do you impeach a Republican President for a crime that was committed by the Democrats? WITCH-HUNT!,05-30-2019 00:32:06,42786,176043,2019-05-30 00:32:06,2019-05-30,2019-05-30,2786.939941,2799.0,2776.73999,2788.860107,2788.860107,3273790000,1.920165999999881,1
Twitter for iPhone,Nothing changes from the Mueller Report. There was insufficient evidence and therefore in our Country a person is innocent. The case is closed! Thank you.,05-29-2019 15:37:21,38234,161166,2019-05-29 15:37:21,2019-05-29,2019-05-29,2790.25,2792.030029,2766.060059,2783.02002,2783.02002,3700050000,-7.229980000000069,0
Twitter for iPhone,...If Alabama does not elect a Republican to the Senate in 2020 many of the incredible gains that we have made during my Presidency may be lost including our Pro-Life victories. Roy Moore cannot win and the consequences will be devastating....Judges and Supreme Court Justices!,05-29-2019 11:40:31,20317,89242,2019-05-29 11:40:31,2019-05-29,2019-05-29,2790.25,2792.030029,2766.060059,2783.02002,2783.02002,3700050000,-7.229980000000069,0
Twitter for iPhone,Republicans cannot allow themselves to again lose the Senate seat in the Great State of Alabama. This time it will be for Six Years not just Two. I have NOTHING against Roy Moore and unlike many other Republican leaders wanted him to win. But he didn’t and probably won’t.....,05-29-2019 11:40:30,21358,96448,2019-05-29 11:40:30,2019-05-29,2019-05-29,2790.25,2792.030029,2766.060059,2783.02002,2783.02002,3700050000,-7.229980000000069,0
Twitter for iPhone,THANK YOU JAPAN!🇺🇸🇯🇵 https://t.co/ZvzEL8iQsi,05-29-2019 00:33:37,63560,268335,2019-05-29 00:33:37,2019-05-29,2019-05-29,2790.25,2792.030029,2766.060059,2783.02002,2783.02002,3700050000,-7.229980000000069,0
Twitter for iPhone,Back from Japan after a very successful trip. Big progress on MANY fronts. A great country with a wonderful leader in Prime Minister Abe!,05-29-2019 00:22:51,19561,103673,2019-05-29 00:22:51,2019-05-29,2019-05-29,2790.25,2792.030029,2766.060059,2783.02002,2783.02002,3700050000,-7.229980000000069,0
Twitter for iPhone,I was actually sticking up for Sleepy Joe Biden while on foreign soil. Kim Jong Un called him a “low IQ idiot” and many other things whereas I related the quote of Chairman Kim as a much softer “low IQ individual.” Who could possibly be upset with that?,05-28-2019 21:58:55,26971,129359,2019-05-28 21:58:55,2019-05-28,2019-05-28,2830.030029,2840.51001,2801.580078,2802.389893,2802.389893,4121410000,-27.640135999999984,0
Twitter for iPhone,Just spoke to Governor @AsaHutchinson of the Great State of Arkansas to inform him that FEMA and the Federal Government will do whatever is necessary to help out with what has turned out to be Record Flooding. Asa and local officials are doing a great job!,05-28-2019 21:24:32,11950,56282,2019-05-28 21:24:32,2019-05-28,2019-05-28,2830.030029,2840.51001,2801.580078,2802.389893,2802.389893,4121410000,-27.640135999999984,0
Twitter for iPhone,.@GovMikeDeWine just updated me on the devastation from the many tornadoes that struck Ohio early this morning. My Administration fully supports the people of the great State of Ohio as they begin the cleanup and recovery.,05-28-2019 19:40:20,11969,59335,2019-05-28 19:40:20,2019-05-28,2019-05-28,2830.030029,2840.51001,2801.580078,2802.389893,2802.389893,4121410000,-27.640135999999984,0
Twitter for iPhone,Storms overnight across Ohio and many other States were very dangerous and damaging. My team continues to update me with reports from emergency managers in the States affected. Listen to your local officials and be resilient. We are with you!,05-28-2019 19:38:00,15375,80201,2019-05-28 19:38:00,2019-05-28,2019-05-28,2830.030029,2840.51001,2801.580078,2802.389893,2802.389893,4121410000,-27.640135999999984,0
Twitter for iPhone,GOD BLESS THE USA🇺🇸 https://t.co/Y8HRT6wnWZ,05-28-2019 12:39:41,35673,159190,2019-05-28 12:39:41,2019-05-28,2019-05-28,2830.030029,2840.51001,2801.580078,2802.389893,2802.389893,4121410000,-27.640135999999984,0
Twitter for iPhone,Spoke with @GovStitt of Oklahoma last night from Japan because of the devastating tornadoes. Told him that @FEMA and the federal government are fully behind him and the great people of Oklahoma.,05-28-2019 08:11:10,13252,64303,2019-05-28 08:11:10,2019-05-28,2019-05-28,2830.030029,2840.51001,2801.580078,2802.389893,2802.389893,4121410000,-27.640135999999984,0
Twitter for iPhone,Can’t wait to see you all soon! https://t.co/KKAw4hqqx5,05-28-2019 00:36:35,19951,91197,2019-05-28 00:36:35,2019-05-28,2019-05-28,2830.030029,2840.51001,2801.580078,2802.389893,2802.389893,4121410000,-27.640135999999984,0
Twitter for iPhone,.....The Dems want a second shot at Bob Mueller are very unhappy with the No Collusion Report. They should not be allowed to play this game any longer - no second chances - must get back to work. So bad for our Country!,05-24-2019 21:41:43,17608,72825,2019-05-24 21:41:43,2019-05-24,2019-05-24,2832.409912,2841.360107,2820.189941,2826.060059,2826.060059,2887390000,-6.3498530000001665,0
Twitter for iPhone,....(with many more to come) and 2 Supreme Court Justices - we are getting into record territory! Thank you all and have a great Memorial Day Weekend.,05-24-2019 20:56:32,15559,80438,2019-05-24 20:56:32,2019-05-24,2019-05-24,2832.409912,2841.360107,2820.189941,2826.060059,2826.060059,2887390000,-6.3498530000001665,0
Twitter for iPhone,Mitch McConnell and our Republican Senators have been very solid and strong. We have accomplished a great deal together in particular with our Courts 107 Federal Judges....,05-24-2019 20:56:31,17598,87453,2019-05-24 20:56:31,2019-05-24,2019-05-24,2832.409912,2841.360107,2820.189941,2826.060059,2826.060059,2887390000,-6.3498530000001665,0
Twitter for iPhone,https://t.co/8GRaqVxR8S,05-24-2019 20:22:08,27602,86830,2019-05-24 20:22:08,2019-05-24,2019-05-24,2832.409912,2841.360107,2820.189941,2826.060059,2826.060059,2887390000,-6.3498530000001665,0
Twitter for iPhone,Departed the @WhiteHouse and am now on Air Force One with the First Lady heading to Japan and looking forward to honoring on behalf of the United States His Majesty the Emperor of Japan. I will also be discussing Trade and Military with my friend Prime Minister @AbeShinzo. https://t.co/uwEjQNbEXE,05-24-2019 19:01:48,19405,86078,2019-05-24 19:01:48,2019-05-24,2019-05-24,2832.409912,2841.360107,2820.189941,2826.060059,2826.060059,2887390000,-6.3498530000001665,0
Twitter for iPhone,I am on Air Force one with the First Lady heading to Japan and looking forward to honoring on behalf of the United States His Majesty the Emperor of Japan. I will also be discussing Trade and Military with my friend Prime Minister @AbeShinzo.,05-24-2019 18:16:37,4997,21699,2019-05-24 18:16:37,2019-05-24,2019-05-24,2832.409912,2841.360107,2820.189941,2826.060059,2826.060059,2887390000,-6.3498530000001665,0
Twitter for iPhone,Just spoke to Prime Minister @NarendraModi where I congratulated him on his big political victory. He is a great man and leader for the people of India - they are lucky to have him!,05-24-2019 18:00:27,45933,213484,2019-05-24 18:00:27,2019-05-24,2019-05-24,2832.409912,2841.360107,2820.189941,2826.060059,2826.060059,2887390000,-6.3498530000001665,0
Twitter for iPhone,Congratulations to Tom Cotton - his book “Sacred Duty: A Solider’s Tour at Arlington National Cemetery” just hit the best sellers list. I was at @ArlingtonNatl yesterday &amp; the people there were so grateful for Tom’s inspiring portrait of “The Old Guard.” Great job @TomCottonAR!,05-24-2019 17:31:18,11391,50955,2019-05-24 17:31:18,2019-05-24,2019-05-24,2832.409912,2841.360107,2820.189941,2826.060059,2826.060059,2887390000,-6.3498530000001665,0
Twitter for iPhone,I don’t know why the Radical Left Democrats want Bob Mueller to testify when he just issued a 40 Million Dollar Report that states loud &amp; clear &amp; for all to hear No Collusion and No Obstruction (how do you Obstruct a NO crime?) Dems are just looking for trouble and a Do-Over!,05-24-2019 12:34:47,22746,92032,2019-05-24 12:34:47,2019-05-24,2019-05-24,2832.409912,2841.360107,2820.189941,2826.060059,2826.060059,2887390000,-6.3498530000001665,0
Twitter for iPhone,“If they try to Impeach President Trump who has done nothing wrong (No Collusion) they will end up getting him re-elected” @LindseyGrahamSC Impeachment is for High Crimes and Misdemeanors. There were no High Crimes and Misdemeanors except for those committed by the other side!,05-24-2019 12:19:56,29072,116586,2019-05-24 12:19:56,2019-05-24,2019-05-24,2832.409912,2841.360107,2820.189941,2826.060059,2826.060059,2887390000,-6.3498530000001665,0
Twitter for iPhone,“Intelligence Agencies were used against an American President.” @DevinNunes  @ShannonBream @FoxNews  This should NEVER happen to a President again! Dems are furious at Robert Mueller for his findings - NO COLLUSION NO OBSTRUCTION. Now they should go back to work and legislate!,05-24-2019 03:49:49,20712,76676,2019-05-24 03:49:49,2019-05-24,2019-05-24,2832.409912,2841.360107,2820.189941,2826.060059,2826.060059,2887390000,-6.3498530000001665,0
Twitter for iPhone,When is Twitter going to allow the very popular Conservative Voices that it has so viciously shut down back into the OPEN? IT IS TIME!,05-24-2019 03:29:22,38884,146613,2019-05-24 03:29:22,2019-05-24,2019-05-24,2832.409912,2841.360107,2820.189941,2826.060059,2826.060059,2887390000,-6.3498530000001665,0
Twitter for iPhone,Wow! CNN Ratings are WAY DOWN record lows. People are getting tired of so many Fake Stories and Anti-Trump lies. Chris Cuomo was rewarded for lowest morning ratings with a prime time spot - which is failing badly and not helping the dumbest man on television Don Lemon!,05-24-2019 03:19:46,25475,108070,2019-05-24 03:19:46,2019-05-24,2019-05-24,2832.409912,2841.360107,2820.189941,2826.060059,2826.060059,2887390000,-6.3498530000001665,0
Twitter for iPhone,71% of Voters rate the Economy as Excellent or Good. The highest number in more than 18 years! @QuinnipiacPoll,05-24-2019 01:19:25,17487,74631,2019-05-24 01:19:25,2019-05-24,2019-05-24,2832.409912,2841.360107,2820.189941,2826.060059,2826.060059,2887390000,-6.3498530000001665,0
Twitter for iPhone,“PELOSI STAMMERS THROUGH NEWS CONFERENCE” https://t.co/1OyCyqRTuk,05-24-2019 01:09:33,31952,97558,2019-05-24 01:09:33,2019-05-24,2019-05-24,2832.409912,2841.360107,2820.189941,2826.060059,2826.060059,2887390000,-6.3498530000001665,0
Twitter for iPhone,“Nancy Pelosi should not be out there doing the kinds of things she is doing. She will diminish herself and her membership. She cannot put a subject with a predicate in the same sentence. What’s going on?”  Ed Rollins  @GreggJarrett  @LouDobbs,05-24-2019 00:39:52,17146,65720,2019-05-24 00:39:52,2019-05-24,2019-05-24,2832.409912,2841.360107,2820.189941,2826.060059,2826.060059,2887390000,-6.3498530000001665,0
Twitter for iPhone,“Today at the request and recommendation of the Attorney General of the United States President Donald J. Trump directed the intelligence community to quickly and fully cooperate with the Attorney General’s investigation into surveillance activities....,05-24-2019 00:19:32,34382,135669,2019-05-24 00:19:32,2019-05-24,2019-05-24,2832.409912,2841.360107,2820.189941,2826.060059,2826.060059,2887390000,-6.3498530000001665,0
Twitter for iPhone,....during the 2016 Presidential election. The Attorney General has also been delegated full and complete authority to declassify information pertaining to this investigation in accordance with the long-established standards for handling classified information....,05-24-2019 00:19:32,22528,96407,2019-05-24 00:19:32,2019-05-24,2019-05-24,2832.409912,2841.360107,2820.189941,2826.060059,2826.060059,2887390000,-6.3498530000001665,0
Twitter for iPhone,....Today’s action will help ensure that all Americans learn the truth about the events that occurred and the actions that were taken during the last Presidential election and will restore confidence in our public institutions.” @PressSec,05-24-2019 00:19:32,27216,113932,2019-05-24 00:19:32,2019-05-24,2019-05-24,2832.409912,2841.360107,2820.189941,2826.060059,2826.060059,2887390000,-6.3498530000001665,0
Twitter for iPhone,@FoxNews Poll: A majority of Americans want the Democrats to stop investigating President Trump. The Mueller Report said very strongly NO COLLUSION which led to NO OBSTRUCTION. The Dems can’t get over 2016 or the conclusive Mueller findings. They are now the Do Nothing Party!,05-24-2019 00:16:44,3248,11768,2019-05-24 00:16:44,2019-05-24,2019-05-24,2832.409912,2841.360107,2820.189941,2826.060059,2826.060059,2887390000,-6.3498530000001665,0
Twitter for iPhone,The U.S. Senate has just approved a 19 Billion Dollar Disaster Relief Bill with my total approval. Great!,05-24-2019 00:11:19,12674,60823,2019-05-24 00:11:19,2019-05-24,2019-05-24,2832.409912,2841.360107,2820.189941,2826.060059,2826.060059,2887390000,-6.3498530000001665,0
Twitter for iPhone,We will never forget our fallen HEROES. It was our great honor to be with you today! #FlagsIn https://t.co/Z6OvQUr8lT,05-23-2019 23:34:53,14477,60316,2019-05-23 23:34:53,2019-05-23,2019-05-23,2836.699951,2836.699951,2805.48999,2822.23999,2822.23999,3891980000,-14.459961000000021,0
Twitter for iPhone,Congratulations to Prime Minister @NarendraModi and his BJP party on their BIG election victory! Great things are in store for the US-India partnership with the return of PM Modi at the helm. I look forward to continuing our important work together!,05-23-2019 17:13:14,51749,238317,2019-05-23 17:13:14,2019-05-23,2019-05-23,2836.699951,2836.699951,2805.48999,2822.23999,2822.23999,3891980000,-14.459961000000021,0
Twitter for iPhone,.@NWS and @USACEHQ are monitoring the damaging storms and flooding in Oklahoma. Listen to the warnings of your local officials and stay safe. We are with you!,05-23-2019 17:07:28,8360,37907,2019-05-23 17:07:28,2019-05-23,2019-05-23,2836.699951,2836.699951,2805.48999,2822.23999,2822.23999,3891980000,-14.459961000000021,0
Twitter for iPhone,Our hearts go out to the people of Missouri as they woke up to assess the damage from storms. You are strong and resilient and we are here to assist. https://t.co/paeOVcUQWn,05-23-2019 17:05:25,11272,49587,2019-05-23 17:05:25,2019-05-23,2019-05-23,2836.699951,2836.699951,2805.48999,2822.23999,2822.23999,3891980000,-14.459961000000021,0
Twitter for iPhone,When the Democrats in Congress refinish for the 5th time their Fake work on their very disappointing Mueller Report finding they will have the time to get the REAL work of the people done. Move quickly!,05-23-2019 14:27:34,18936,78777,2019-05-23 14:27:34,2019-05-23,2019-05-23,2836.699951,2836.699951,2805.48999,2822.23999,2822.23999,3891980000,-14.459961000000021,0
Twitter for iPhone,I was extremely calm yesterday with my meeting with Pelosi and Schumer knowing that they would say I was raging which they always do along with their partner the Fake News Media. Well so many stories about the meeting use the Rage narrative anyway - Fake &amp; Corrupt Press!,05-23-2019 14:13:39,25140,106017,2019-05-23 14:13:39,2019-05-23,2019-05-23,2836.699951,2836.699951,2805.48999,2822.23999,2822.23999,3891980000,-14.459961000000021,0
Twitter for iPhone,Rex Tillerson a man who is “dumb as a rock” and totally ill prepared and ill equipped to be Secretary of State made up a story (he got fired) that I was out-prepared by Vladimir Putin at a meeting in Hamburg Germany. I don’t think Putin would agree. Look how the U.S. is doing!,05-23-2019 12:29:04,17024,76624,2019-05-23 12:29:04,2019-05-23,2019-05-23,2836.699951,2836.699951,2805.48999,2822.23999,2822.23999,3891980000,-14.459961000000021,0
Twitter for iPhone,The Democrats have become known as THE DO NOTHING PARTY!,05-23-2019 11:58:57,22956,95734,2019-05-23 11:58:57,2019-05-23,2019-05-23,2836.699951,2836.699951,2805.48999,2822.23999,2822.23999,3891980000,-14.459961000000021,0
Twitter for iPhone,....drug prices pre-existing conditions and our great Vets. All they are geared up to do six committees is squander time day after day trying to find anything which will be bad for me. A pure fishing expedition like this never happened before &amp; it should never happen again!,05-23-2019 11:56:04,18621,84541,2019-05-23 11:56:04,2019-05-23,2019-05-23,2836.699951,2836.699951,2805.48999,2822.23999,2822.23999,3891980000,-14.459961000000021,0
Twitter for iPhone,The Democrats are getting nothing done in Congress. All of their effort is about a Re-Do of the Mueller Report which didn’t turn out the way they wanted. It is not possible for them to investigate and legislate at the same time. Their heart is not into Infrastructure lower.....,05-23-2019 11:56:03,21924,96165,2019-05-23 11:56:03,2019-05-23,2019-05-23,2836.699951,2836.699951,2805.48999,2822.23999,2822.23999,3891980000,-14.459961000000021,0
Twitter for iPhone,Democrats don’t want to fix the loopholes at the Border. They don’t want to do anything. Open Borders and crime!,05-23-2019 02:54:59,19030,75420,2019-05-23 02:54:59,2019-05-23,2019-05-23,2836.699951,2836.699951,2805.48999,2822.23999,2822.23999,3891980000,-14.459961000000021,0
Twitter for iPhone,Zero is getting done with the Democrats in charge of the House. All they want to do is put the Mueller Report behind them and start all over again. No Do-Overs!,05-23-2019 02:31:52,21128,89913,2019-05-23 02:31:52,2019-05-23,2019-05-23,2836.699951,2836.699951,2805.48999,2822.23999,2822.23999,3891980000,-14.459961000000021,0
Twitter for iPhone,In a letter to her House colleagues Nancy Pelosi said: “President Trump had a temper tantrum for us all to see.” This is not true. I was purposely very polite and calm much as I was minutes later with the press in the Rose Garden. Can be easily proven. It is all such a lie!,05-23-2019 02:28:36,29647,131820,2019-05-23 02:28:36,2019-05-23,2019-05-23,2836.699951,2836.699951,2805.48999,2822.23999,2822.23999,3891980000,-14.459961000000021,0
Twitter for iPhone,I want to welcome you all to the @WhiteHouse as we award our very bravest law enforcement officers and firefighters our nation’s highest public safety award – The Medal of Valor...https://t.co/68EeQk8ZHr,05-22-2019 20:46:35,16674,68614,2019-05-22 20:46:35,2019-05-22,2019-05-22,2856.060059,2865.469971,2851.110107,2856.27002,2856.27002,3192510000,0.20996100000002116,1
Twitter for iPhone,....Democrat leadership is tearing the United States apart but I will continue to set records for the American People – and Nancy thank you so much for your prayers I know you truly mean it!,05-22-2019 17:02:23,21388,95678,2019-05-22 17:02:23,2019-05-22,2019-05-22,2856.060059,2865.469971,2851.110107,2856.27002,2856.27002,3192510000,0.20996100000002116,1
Twitter for iPhone,....But they really want a do-over! You can’t investigate and legislate simultaneously - it just doesn’t work that way. You can’t go down two tracks at the same time. Let Chuck Nancy Jerry Adam and all of the rest finish playing their games....,05-22-2019 17:01:22,8870,31664,2019-05-22 17:01:22,2019-05-22,2019-05-22,2856.060059,2865.469971,2851.110107,2856.27002,2856.27002,3192510000,0.20996100000002116,1
Twitter for iPhone,....In the meantime my Administration is achieving things that have never been done before including unleashing perhaps the Greatest Economy in our Country’s history....,05-22-2019 17:01:22,17875,89687,2019-05-22 17:01:22,2019-05-22,2019-05-22,2856.060059,2865.469971,2851.110107,2856.27002,2856.27002,3192510000,0.20996100000002116,1
Twitter for iPhone,So sad that Nancy Pelosi and Chuck Schumer will never be able to see or understand the great promise of our Country. They can continue the Witch Hunt which has already cost $40M and been a tremendous waste of time and energy for everyone in America or get back to work....,05-22-2019 17:01:21,31226,135436,2019-05-22 17:01:21,2019-05-22,2019-05-22,2856.060059,2865.469971,2851.110107,2856.27002,2856.27002,3192510000,0.20996100000002116,1
Twitter for iPhone,https://t.co/Oe8E5kk8OA,05-22-2019 16:57:35,13315,43148,2019-05-22 16:57:35,2019-05-22,2019-05-22,2856.060059,2865.469971,2851.110107,2856.27002,2856.27002,3192510000,0.20996100000002116,1
Twitter for iPhone,As I have long been saying and has now been proven out this is a Witch Hunt against the Republican Party and myself and it was the other side that caused the problem not us!,05-22-2019 15:15:40,23634,101443,2019-05-22 15:15:40,2019-05-22,2019-05-22,2856.060059,2865.469971,2851.110107,2856.27002,2856.27002,3192510000,0.20996100000002116,1
Twitter for iPhone,..BETWEEN RUSSIA AND THE TRUMP CAMPAIGN. Mr. McGahn can be forgiven for declining the honor of appearing in Mr. Nadler’s pseudo-impeachment drama.” Wall Street Journal Editorial BoardToday - May 21 2019,05-22-2019 15:11:16,13646,58124,2019-05-22 15:11:16,2019-05-22,2019-05-22,2856.060059,2865.469971,2851.110107,2856.27002,2856.27002,3192510000,0.20996100000002116,1
Twitter for iPhone,“He (Jerry Nadler) wants a show. He wants to use Mr. McGahn as a prop to spend three hours claiming that Mr. Trump tried to obstruct the Mueller investigation. YET MR. MUELLER WASN’T OBSTRUCTED IN ANY WAY HIS COPIOUS REPORT WAS RELEASED FOR ALL TO SEE &amp; THERE WAS NO COLLUSION..,05-22-2019 15:11:15,19327,79419,2019-05-22 15:11:15,2019-05-22,2019-05-22,2856.060059,2865.469971,2851.110107,2856.27002,2856.27002,3192510000,0.20996100000002116,1
Twitter for iPhone,“The Democrats are in danger of becoming irrelevant because of their decision to keep taking the country on wild goose chases. They ought to start governing. You know for a change.”  Michael Goodwin @newyorkpost,05-22-2019 13:54:27,16177,60680,2019-05-22 13:54:27,2019-05-22,2019-05-22,2856.060059,2865.469971,2851.110107,2856.27002,2856.27002,3192510000,0.20996100000002116,1
Twitter for iPhone,Everybody including me thought that when the 40 Million Dollar Mueller Report was released with No Collusion and No Obstruction (of a crime caused by others) that was the end. But no the Democrats want to keep it going in an effort to help them in 2020. Bad for the Country!,05-22-2019 13:50:42,17734,69872,2019-05-22 13:50:42,2019-05-22,2019-05-22,2856.060059,2865.469971,2851.110107,2856.27002,2856.27002,3192510000,0.20996100000002116,1
Twitter for iPhone,Much of the Wall being built at the Southern Border is a complete demolition and rebuilding of old and worthless barriers with a brand new Wall and footings. Problem is the Haters say that is not a new Wall but rather a renovation. Wrong and we must build where most needed....,05-22-2019 11:22:36,19655,95939,2019-05-22 11:22:36,2019-05-22,2019-05-22,2856.060059,2865.469971,2851.110107,2856.27002,2856.27002,3192510000,0.20996100000002116,1
Twitter for iPhone,Also tremendous work is being done on pure renovation - fixing existing Walls that are in bad condition and ineffective and bringing them to a very high standard!,05-22-2019 11:22:36,14554,73956,2019-05-22 11:22:36,2019-05-22,2019-05-22,2856.060059,2865.469971,2851.110107,2856.27002,2856.27002,3192510000,0.20996100000002116,1
Twitter for iPhone,Without the ILLEGAL Witch Hunt my poll numbers especially because of our historically “great” economy would be at 65%. Too bad! The greatest Hoax in American History.,05-22-2019 11:00:15,17090,71747,2019-05-22 11:00:15,2019-05-22,2019-05-22,2856.060059,2865.469971,2851.110107,2856.27002,2856.27002,3192510000,0.20996100000002116,1
Twitter for iPhone,PRESIDENTIAL HARASSMENT!,05-22-2019 10:03:51,25473,108688,2019-05-22 10:03:51,2019-05-22,2019-05-22,2856.060059,2865.469971,2851.110107,2856.27002,2856.27002,3192510000,0.20996100000002116,1
Twitter for iPhone,The Democrats are getting ZERO work done in Congress. All they are focused on is trying to prove the Mueller Report wrong the Witch Hunt!,05-22-2019 10:02:55,15679,60685,2019-05-22 10:02:55,2019-05-22,2019-05-22,2856.060059,2865.469971,2851.110107,2856.27002,2856.27002,3192510000,0.20996100000002116,1
Twitter for iPhone,After two years of an expensive and comprehensive Witch Hunt the Democrats don’t like the result and they want a DO OVER. In other words the Witch Hunt continues!,05-22-2019 09:58:59,12274,51666,2019-05-22 09:58:59,2019-05-22,2019-05-22,2856.060059,2865.469971,2851.110107,2856.27002,2856.27002,3192510000,0.20996100000002116,1
Twitter for iPhone,Everything the Democrats are asking me for is based on an illegally started investigation that failed for them especially when the Mueller Report came back with a NO COLLUSION finding. Now they say Impeach President Trump even though he did nothin wrong while they “fish!”,05-22-2019 09:55:14,17591,68880,2019-05-22 09:55:14,2019-05-22,2019-05-22,2856.060059,2865.469971,2851.110107,2856.27002,2856.27002,3192510000,0.20996100000002116,1
Twitter for iPhone,Congratulations to Governor @MattBevin on winning the Republican Primary for Governor tonight in the Great State of KENTUCKY. Matt you are doing a fantastic job!,05-22-2019 02:29:40,12349,57288,2019-05-22 02:29:40,2019-05-22,2019-05-22,2856.060059,2865.469971,2851.110107,2856.27002,2856.27002,3192510000,0.20996100000002116,1
Twitter for iPhone,Great news for Republicans: Fred Keller has just won the hard fought for Pennsylvania Congressional contest in a LANDSLIDE over 70% of the vote. Thanks to the thousands who showed up for the Rally last night. Congratulations to Fred and his wonderful family!,05-22-2019 02:20:51,22323,97302,2019-05-22 02:20:51,2019-05-22,2019-05-22,2856.060059,2865.469971,2851.110107,2856.27002,2856.27002,3192510000,0.20996100000002116,1
Twitter for iPhone,John Brennan on the Mueller probe “I don’t know if I received bad information but I THINK I SUSPECTED THAT THERE WAS MORE THAN THERE ACTUALLY WAS.” Wow he admits he was wrong! Congress should go back to work on drug prices etc.,05-22-2019 01:02:38,19411,72769,2019-05-22 01:02:38,2019-05-22,2019-05-22,2856.060059,2865.469971,2851.110107,2856.27002,2856.27002,3192510000,0.20996100000002116,1
Twitter for iPhone,The Democrats are on a fishing expedition wanting to interview the same people and see the same things as we just went through for two years with Robert Mueller and the 18 Angry Dems. Never happened to a president before. Never even happened to President Obama!,05-22-2019 00:51:43,19875,81654,2019-05-22 00:51:43,2019-05-22,2019-05-22,2856.060059,2865.469971,2851.110107,2856.27002,2856.27002,3192510000,0.20996100000002116,1
Twitter for iPhone,After spending 40 Million Dollars reviewing 1.4 million pages of documents &amp; interviewing 500 people with the total support of the White House the Mueller Report was a BIG DISAPPOINTMENT to the Democrats so they want a DO OVER. It doesn’t work that way-so bad for our Country!,05-22-2019 00:32:40,17487,68302,2019-05-22 00:32:40,2019-05-22,2019-05-22,2856.060059,2865.469971,2851.110107,2856.27002,2856.27002,3192510000,0.20996100000002116,1
Twitter for iPhone,Shahira Knight has done a wonderful job as my Legislative Affairs Director at the White House. She was outstanding for us and for our Country - will be a tremendous success in the private sector!,05-21-2019 22:48:50,8971,45423,2019-05-21 22:48:50,2019-05-21,2019-05-21,2854.02002,2868.8798829999996,2854.02002,2864.360107,2864.360107,3218700000,10.34008700000004,1
Twitter for iPhone,Wow Mark Levin’s new book opened at #1. It is great – keep it there for a long time! https://t.co/3F1xybks0R,05-21-2019 22:00:15,13146,50268,2019-05-21 22:00:15,2019-05-21,2019-05-21,2854.02002,2868.8798829999996,2854.02002,2864.360107,2864.360107,3218700000,10.34008700000004,1
Twitter for iPhone,Johnny we will miss you – you did a great job! https://t.co/eXaASLgeSh,05-21-2019 21:53:23,8064,39201,2019-05-21 21:53:23,2019-05-21,2019-05-21,2854.02002,2868.8798829999996,2854.02002,2864.360107,2864.360107,3218700000,10.34008700000004,1
Twitter for iPhone,So even though I didn’t have to do it with Presidential Privilege I allowed everyone to testify including White House Counsel Don McGahn (for over 30 hours) to Robert Mueller and the 18 Angry Trump-Hating Democrats and they arrived....,05-21-2019 21:22:52,17768,81729,2019-05-21 21:22:52,2019-05-21,2019-05-21,2854.02002,2868.8798829999996,2854.02002,2864.360107,2864.360107,3218700000,10.34008700000004,1
Twitter for iPhone,....at a conclusion of NO COLLUSION and NO OBSTRUCTION! The Dems were unhappy with the outcome of the $40M Mueller Report so now they want a do-over.,05-21-2019 21:22:52,15921,74518,2019-05-21 21:22:52,2019-05-21,2019-05-21,2854.02002,2868.8798829999996,2854.02002,2864.360107,2864.360107,3218700000,10.34008700000004,1
Twitter for iPhone,I am pleased to announce my nomination of Barbara Barrett of Arizona and former Chairman of the Aerospace Corporation to be the next Secretary of the Air Force. She will be an outstanding Secretary! #FlyFightWin,05-21-2019 20:52:46,13836,62962,2019-05-21 20:52:46,2019-05-21,2019-05-21,2854.02002,2868.8798829999996,2854.02002,2864.360107,2864.360107,3218700000,10.34008700000004,1
Twitter for iPhone,Pennsylvania - Don’t forget to get out and VOTE TODAY for Republican Fred Keller for Congress. Fred is Strong on Crime Second Amendment Military Vets and Healthcare. He has my Complete and Total Endorsement!,05-21-2019 16:38:40,14612,55244,2019-05-21 16:38:40,2019-05-21,2019-05-21,2854.02002,2868.8798829999996,2854.02002,2864.360107,2864.360107,3218700000,10.34008700000004,1
Twitter for iPhone,...Mexico’s attitude is that people from other countries including Mexico should have the right to flow into the U.S. &amp; that U.S. taxpayers should be responsible for the tremendous costs associated w/this illegal migration. Mexico is wrong and I will soon be giving a response!,05-21-2019 16:16:54,22061,98932,2019-05-21 16:16:54,2019-05-21,2019-05-21,2854.02002,2868.8798829999996,2854.02002,2864.360107,2864.360107,3218700000,10.34008700000004,1
Twitter for iPhone,I am very disappointed that Mexico is doing virtually nothing to stop illegal immigrants from coming to our Southern Border where everyone knows that because of the Democrats our Immigration Laws are totally flawed &amp; broken...,05-21-2019 16:16:53,24258,109588,2019-05-21 16:16:53,2019-05-21,2019-05-21,2854.02002,2868.8798829999996,2854.02002,2864.360107,2864.360107,3218700000,10.34008700000004,1
Twitter for iPhone,To the great people of Kentucky please go out and vote for Matt Bevin today. Very important. He has done a fantastic job for you and America! #MAGA,05-21-2019 15:25:09,16250,64873,2019-05-21 15:25:09,2019-05-21,2019-05-21,2854.02002,2868.8798829999996,2854.02002,2864.360107,2864.360107,3218700000,10.34008700000004,1
Twitter for iPhone,Just returned to the beautiful @WhiteHouse after a great evening in Pennsylvania! https://t.co/wMeh9k9knv,05-21-2019 02:06:31,15196,87498,2019-05-21 02:06:31,2019-05-21,2019-05-21,2854.02002,2868.8798829999996,2854.02002,2864.360107,2864.360107,3218700000,10.34008700000004,1
Twitter for iPhone,Megan King who is running for Superior Court Judge in the Pennsylvania election has my Full and Total Endorsement. She is tough on crime and fully understands all aspects of the law. Vote for Megan tomorrow (Tuesday).,05-21-2019 02:02:28,18565,73978,2019-05-21 02:02:28,2019-05-21,2019-05-21,2854.02002,2868.8798829999996,2854.02002,2864.360107,2864.360107,3218700000,10.34008700000004,1
Twitter for iPhone,Massive crowds in Pennsylvania tonight. Thank you for joining me! https://t.co/v1e0d0AHHo,05-21-2019 01:04:55,17367,74657,2019-05-21 01:04:55,2019-05-21,2019-05-21,2854.02002,2868.8798829999996,2854.02002,2864.360107,2864.360107,3218700000,10.34008700000004,1
Twitter for iPhone,Beautiful evening for a MAKE AMERICA GREAT AGAIN rally tonight in Pennsylvania. Thank you I love you! #MAGA https://t.co/6oqbA5Y5zU,05-21-2019 00:45:41,16227,65511,2019-05-21 00:45:41,2019-05-21,2019-05-21,2854.02002,2868.8798829999996,2854.02002,2864.360107,2864.360107,3218700000,10.34008700000004,1
Twitter for iPhone,Landing shortly in Montoursville Pennsylvania - see everyone shortly! https://t.co/R67IxP3QPL,05-20-2019 22:39:53,12221,55515,2019-05-20 22:39:53,2019-05-20,2019-05-20,2841.939941,2853.860107,2831.290039,2840.22998,2840.22998,3288870000,-1.7099610000000212,0
Twitter for iPhone,Fred Keller of the Great State of Pennsylvania has been an outstanding State Representative. Now he is running as the Republican Nominee for Congress and has my Complete and Total Endorsement. He will do a fantastic job - I look forward to seeing everyone tonight! #MAGA,05-20-2019 18:07:30,15315,60970,2019-05-20 18:07:30,2019-05-20,2019-05-20,2841.939941,2853.860107,2831.290039,2840.22998,2840.22998,3288870000,-1.7099610000000212,0
Twitter for iPhone,See you tonight at 7:00 P.M. Eastern Montoursville Pennsylvania! #MAGA https://t.co/Ij2AjXfRZa,05-20-2019 17:40:23,10804,42348,2019-05-20 17:40:23,2019-05-20,2019-05-20,2841.939941,2853.860107,2831.290039,2840.22998,2840.22998,3288870000,-1.7099610000000212,0
Twitter for iPhone,The Fake News put out a typically false statement without any knowledge that the United States was trying to set up a negotiation with Iran. This is a false report....,05-20-2019 17:30:35,18784,80355,2019-05-20 17:30:35,2019-05-20,2019-05-20,2841.939941,2853.860107,2831.290039,2840.22998,2840.22998,3288870000,-1.7099610000000212,0
Twitter for iPhone,....Iran will call us if and when they are ever ready. In the meantime their economy continues to collapse - very sad for the Iranian people!,05-20-2019 17:30:35,15447,71299,2019-05-20 17:30:35,2019-05-20,2019-05-20,2841.939941,2853.860107,2831.290039,2840.22998,2840.22998,3288870000,-1.7099610000000212,0
Twitter for iPhone,On this Cuban Independence Day we stand by the people of Cuba in their quest for freedom democracy and prosperity. The Cuban regime must end its repression of Cubans &amp; Venezuelans. The United States will not stand idly by as Cuba continues to subvert democracy in the Americas!,05-20-2019 17:28:03,16262,65758,2019-05-20 17:28:03,2019-05-20,2019-05-20,2841.939941,2853.860107,2831.290039,2840.22998,2840.22998,3288870000,-1.7099610000000212,0
Twitter for iPhone,Looks like Bernie Sanders is history. Sleepy Joe Biden is pulling ahead and think about it I’m only here because of Sleepy Joe and the man who took him off the 1% trash heap President O! China wants Sleepy Joe BADLY!,05-20-2019 14:08:04,25412,112933,2019-05-20 14:08:04,2019-05-20,2019-05-20,2841.939941,2853.860107,2831.290039,2840.22998,2840.22998,3288870000,-1.7099610000000212,0
Twitter for iPhone,Why are the Democrats not looking into all of the crimes committed by Crooked Hillary and the phony Russia Investigation? They would get back their credibility. Jerry Nadler Schiff  would have a whole new future open to them. Perhaps they could even run for President!,05-20-2019 12:13:31,19822,80370,2019-05-20 12:13:31,2019-05-20,2019-05-20,2841.939941,2853.860107,2831.290039,2840.22998,2840.22998,3288870000,-1.7099610000000212,0
Twitter for iPhone,“We have a booming economy and working people are making gains that they haven’t seen in decades.”  Stuart Varney @foxandfriends,05-20-2019 12:07:33,13671,61937,2019-05-20 12:07:33,2019-05-20,2019-05-20,2841.939941,2853.860107,2831.290039,2840.22998,2840.22998,3288870000,-1.7099610000000212,0
Twitter for iPhone,Two Tweets missing from last batch probably a Twitter error. No time for a redo! Only the Dems get redos!,05-20-2019 11:35:31,1101,4267,2019-05-20 11:35:31,2019-05-20,2019-05-20,2841.939941,2853.860107,2831.290039,2840.22998,2840.22998,3288870000,-1.7099610000000212,0
Twitter for iPhone,.....was very good and highly professional to deal with - and if for any reason I didn’t like them I would have gone elsewhere....there was always plenty of money around and banks to choose from. They would be very happy to take my money. Fake News!,05-20-2019 11:20:54,14015,73999,2019-05-20 11:20:54,2019-05-20,2019-05-20,2841.939941,2853.860107,2831.290039,2840.22998,2840.22998,3288870000,-1.7099610000000212,0
Twitter for iPhone,The Failing New York Times (it will pass away when I leave office in 6 years) and others of the Fake News Media keep writing phony stories about how I didn’t use many banks because they didn’t want to do business with me. WRONG! It is because I didn’t need money. Very old,05-20-2019 11:20:53,20578,101881,2019-05-20 11:20:53,2019-05-20,2019-05-20,2841.939941,2853.860107,2831.290039,2840.22998,2840.22998,3288870000,-1.7099610000000212,0
Twitter for iPhone,....fashioned but true. When you don’t need or want money you don’t need or want banks. Banks have always been available to me they want to make money. Fake Media only says this to disparage and always uses unnamed sources (because their sources don’t even exist)......,05-20-2019 11:20:53,5585,21903,2019-05-20 11:20:53,2019-05-20,2019-05-20,2841.939941,2853.860107,2831.290039,2840.22998,2840.22998,3288870000,-1.7099610000000212,0
Twitter for iPhone,The Mainstream Media has never been as corrupt and deranged as it is today. FAKE NEWS is actually the biggest story of all and is the true ENEMY OF THE PEOPLE! That’s why they refuse to cover the REAL Russia Hoax. But the American people are wise to what is going on.....,05-20-2019 11:20:53,8072,26490,2019-05-20 11:20:53,2019-05-20,2019-05-20,2841.939941,2853.860107,2831.290039,2840.22998,2840.22998,3288870000,-1.7099610000000212,0
Twitter for iPhone,....Now the new big story is that Trump made a lot of money and buys everything for cash he doesn’t need banks. But where did he get all of that cash? Could it be Russia? No I built a great business and don’t need banks but if I did they would be there...and DeutscheBank......,05-20-2019 11:20:53,13959,72571,2019-05-20 11:20:53,2019-05-20,2019-05-20,2841.939941,2853.860107,2831.290039,2840.22998,2840.22998,3288870000,-1.7099610000000212,0
Twitter for iPhone,The Mainstream Media hates to cover this! https://t.co/EMhAVWCjVf,05-20-2019 02:32:36,11602,46166,2019-05-20 02:32:36,2019-05-20,2019-05-20,2841.939941,2853.860107,2831.290039,2840.22998,2840.22998,3288870000,-1.7099610000000212,0
Twitter for iPhone,Starting Monday our great Farmers can begin doing business again with Mexico and Canada. They have both taken the tariff penalties off of your great agricultural product. Please be sure that you are treated fairly. Any complaints should immediately go to  @SecretarySonny Perdue!,05-20-2019 02:29:27,18326,69287,2019-05-20 02:29:27,2019-05-20,2019-05-20,2841.939941,2853.860107,2831.290039,2840.22998,2840.22998,3288870000,-1.7099610000000212,0
Twitter for iPhone,A great win for Brooks. Congratulations to a great champion! https://t.co/74z0n2icuA,05-20-2019 02:16:24,6185,39735,2019-05-20 02:16:24,2019-05-20,2019-05-20,2841.939941,2853.860107,2831.290039,2840.22998,2840.22998,3288870000,-1.7099610000000212,0
Twitter for iPhone,Consumer Sentiment in the month of May is the highest in 15 years. Very nice! @FoxNews,05-17-2019 22:49:34,17649,86366,2019-05-17 22:49:34,2019-05-17,2019-05-17,2858.600098,2885.47998,2854.22998,2859.530029,2859.530029,3257950000,0.9299310000001242,1
Twitter for iPhone,Today it was my great honor to address the the National Association of REALTORS! https://t.co/LQNExa57ne,05-17-2019 19:41:59,11824,53565,2019-05-17 19:41:59,2019-05-17,2019-05-17,2858.600098,2885.47998,2854.22998,2859.530029,2859.530029,3257950000,0.9299310000001242,1
Twitter for iPhone,With all of the Fake and Made Up News out there Iran can have no idea what is actually going on!,05-17-2019 16:53:00,20882,92642,2019-05-17 16:53:00,2019-05-17,2019-05-17,2858.600098,2885.47998,2854.22998,2859.530029,2859.530029,3257950000,0.9299310000001242,1
Twitter for iPhone,It now seems the General Flynn was under investigation long before was common knowledge. It would have been impossible for me to know this but if that was the case and with me being one of two people who would become president why was I not told so that I could make a change?,05-17-2019 14:35:05,31255,127475,2019-05-17 14:35:05,2019-05-17,2019-05-17,2858.600098,2885.47998,2854.22998,2859.530029,2859.530029,3257950000,0.9299310000001242,1
Twitter for iPhone,The Fake News Media is hurting our Country with its fraudulent and highly inaccurate coverage of Iran. It is scattershot poorly sourced (made up) and DANGEROUS. At least Iran doesn’t know what to think which at this point may very well be a good thing!,05-17-2019 13:44:35,19990,77435,2019-05-17 13:44:35,2019-05-17,2019-05-17,2858.600098,2885.47998,2854.22998,2859.530029,2859.530029,3257950000,0.9299310000001242,1
Twitter for iPhone,Will Jerry Nadler ever look into the fact that Crooked Hillary deleted and acid washed 33000 emails AFTER getting a most powerful demand notice for them from Congress?,05-17-2019 12:16:40,30627,110639,2019-05-17 12:16:40,2019-05-17,2019-05-17,2858.600098,2885.47998,2854.22998,2859.530029,2859.530029,3257950000,0.9299310000001242,1
Twitter for iPhone,My Campaign for President was conclusively spied on. Nothing like this has ever happened in American Politics. A really bad situation. TREASON means long jail sentences and this was TREASON!,05-17-2019 11:11:45,39378,136146,2019-05-17 11:11:45,2019-05-17,2019-05-17,2858.600098,2885.47998,2854.22998,2859.530029,2859.530029,3257950000,0.9299310000001242,1
Twitter for iPhone,New Fox Poll: 58% of people say that the FBI broke the law in investigating Donald J. Trump. @foxandfriends,05-17-2019 11:05:30,20008,87485,2019-05-17 11:05:30,2019-05-17,2019-05-17,2858.600098,2885.47998,2854.22998,2859.530029,2859.530029,3257950000,0.9299310000001242,1
Twitter for iPhone,MAKE AMERICA GREAT AGAIN!,05-17-2019 11:01:01,41975,207026,2019-05-17 11:01:01,2019-05-17,2019-05-17,2858.600098,2885.47998,2854.22998,2859.530029,2859.530029,3257950000,0.9299310000001242,1
Twitter for iPhone,DRAIN THE SWAMP!,05-17-2019 11:00:06,23558,103617,2019-05-17 11:00:06,2019-05-17,2019-05-17,2858.600098,2885.47998,2854.22998,2859.530029,2859.530029,3257950000,0.9299310000001242,1
Twitter for iPhone,“What happened is that Donald Trump won. Down goes Comey.” @foxandfriends,05-17-2019 10:58:43,14178,66947,2019-05-17 10:58:43,2019-05-17,2019-05-17,2858.600098,2885.47998,2854.22998,2859.530029,2859.530029,3257950000,0.9299310000001242,1
Twitter for iPhone,Will the Democrats give our Country a badly needed immigration win before the election? Good chance!,05-17-2019 10:53:25,13653,64140,2019-05-17 10:53:25,2019-05-17,2019-05-17,2858.600098,2885.47998,2854.22998,2859.530029,2859.530029,3257950000,0.9299310000001242,1
Twitter for iPhone,All people that are illegally coming into the United States now will be removed from our Country at a later date as we build up our removal forces and as the laws are changed. Please do not make yourselves too comfortable you will be leaving soon!,05-17-2019 10:51:34,45841,176208,2019-05-17 10:51:34,2019-05-17,2019-05-17,2858.600098,2885.47998,2854.22998,2859.530029,2859.530029,3257950000,0.9299310000001242,1
Twitter for iPhone,Border Patrol is apprehending record numbers of people at the Southern Border. The bad “hombres” of which there are many are being detained &amp; will be sent home. Those which we release under the ridiculous Catch &amp; Telease loophole are being registered and will be removed later!,05-17-2019 10:44:53,15809,65120,2019-05-17 10:44:53,2019-05-17,2019-05-17,2858.600098,2885.47998,2854.22998,2859.530029,2859.530029,3257950000,0.9299310000001242,1
Twitter for iPhone,The Democrats now realize that there is a National Emergency at the Border and that if we work together it can be immediately fixed. We need Democrat votes and all will be well!,05-17-2019 10:36:38,15691,69732,2019-05-17 10:36:38,2019-05-17,2019-05-17,2858.600098,2885.47998,2854.22998,2859.530029,2859.530029,3257950000,0.9299310000001242,1
Twitter for iPhone,.@BilldeBlasio is the worst Mayor in the history of New York City - he won’t last long! https://t.co/NyYntsX573,05-16-2019 22:11:37,26182,106297,2019-05-16 22:11:37,2019-05-16,2019-05-16,2855.800049,2892.149902,2855.800049,2876.320068,2876.320068,3338060000,20.520019000000048,1
Twitter for iPhone,We are here on this beautiful spring day to unveil our plan to create a fair modern &amp; LAWFUL system of immigration for the U.S. If adopted our plan will transform America’s immigration system into the pride of our Nation and the envy of the modern world. https://t.co/YqyTYgTByD,05-16-2019 19:13:58,20905,80047,2019-05-16 19:13:58,2019-05-16,2019-05-16,2855.800049,2892.149902,2855.800049,2876.320068,2876.320068,3338060000,20.520019000000048,1
Twitter for iPhone,Congratulations to Dan Bishop on his big Republican Primary victory in the 9th Congressional District of North Carolina. Dan is strong on Crime Loves our Military Vets 2A and great Healthcare. He has my Complete and Total Endorsement! #MAGA,05-16-2019 16:53:23,15939,73851,2019-05-16 16:53:23,2019-05-16,2019-05-16,2855.800049,2892.149902,2855.800049,2876.320068,2876.320068,3338060000,20.520019000000048,1
Twitter for iPhone,The Dems are getting another beauty to join their group. Bill de Blasio of NYC considered the worst mayor in the U.S. will supposedly be making an announcement for president today. He is a JOKE but if you like high taxes &amp; crime he’s your man. NYC HATES HIM!,05-16-2019 12:33:40,30836,130036,2019-05-16 12:33:40,2019-05-16,2019-05-16,2855.800049,2892.149902,2855.800049,2876.320068,2876.320068,3338060000,20.520019000000048,1
Twitter for iPhone,The Fake News Washington Post and even more Fake News New York Times are writing stories that there is infighting with respect to my strong policy in the Middle East. There is no infighting whatsoever....,05-15-2019 19:10:47,23071,105547,2019-05-15 19:10:47,2019-05-15,2019-05-15,2820.3798829999996,2858.679932,2815.080078,2850.959961,2850.959961,3125950000,30.580078000000412,1
Twitter for iPhone,....Different opinions are expressed and I make a decisive and final decision - it is a very simple process. All sides views and policies are covered. I’m sure that Iran will want to talk soon.,05-15-2019 19:10:47,17143,85084,2019-05-15 19:10:47,2019-05-15,2019-05-15,2820.3798829999996,2858.679932,2815.080078,2850.959961,2850.959961,3125950000,30.580078000000412,1
Twitter for iPhone,We stand firmly strongly and proudly with the incredible men and women of law enforcement. You do not hear it nearly enough but Americans across this Country love you support you and respect you more than you could possibly know! #PeaceOfficersMemorialDay https://t.co/T0qB5zN7WG,05-15-2019 18:56:51,23854,96673,2019-05-15 18:56:51,2019-05-15,2019-05-15,2820.3798829999996,2858.679932,2815.080078,2850.959961,2850.959961,3125950000,30.580078000000412,1
Twitter for iPhone,The courage &amp; sacrifice of our heroes is the reason our flag stands tall our hearts beat with pride and our Country remains one people one family and one NATION UNDER GOD. Today we thank you we honor you &amp; we forever cherish the memory of our Fallen Men and Women in Blue! https://t.co/ARHYgDVi3M,05-15-2019 18:20:30,20112,82992,2019-05-15 18:20:30,2019-05-15,2019-05-15,2820.3798829999996,2858.679932,2815.080078,2850.959961,2850.959961,3125950000,30.580078000000412,1
Twitter for iPhone,Thank you Joe and remember the BRAIN is much sharper also! https://t.co/h1fG1GRQ99,05-15-2019 12:53:28,23178,107248,2019-05-15 12:53:28,2019-05-15,2019-05-15,2820.3798829999996,2858.679932,2815.080078,2850.959961,2850.959961,3125950000,30.580078000000412,1
Twitter for iPhone,The golden era of American energy is now underway! https://t.co/gEmhoMlLoc,05-15-2019 00:25:44,24439,103605,2019-05-15 00:25:44,2019-05-15,2019-05-15,2820.3798829999996,2858.679932,2815.080078,2850.959961,2850.959961,3125950000,30.580078000000412,1
Twitter for iPhone,With incredible grit skill and pride the 7000 workers here at Sempra Energy are helping lead the American Energy Revolution. They are not only making our nation WEALTHIER but they are making America SAFER by building a future of American Energy INDEPENDENCE! https://t.co/Hqn9wEIXo9,05-14-2019 21:14:12,14743,59004,2019-05-14 21:14:12,2019-05-14,2019-05-14,2820.1201170000004,2852.540039,2820.1201170000004,2834.409912,2834.409912,3322720000,14.289794999999685,1
Twitter for iPhone,It is great to be here in Hackberry Louisiana with the incredible men and women who are making America into the energy superpower of the world! https://t.co/l0DrjtHf62,05-14-2019 20:45:21,14635,59772,2019-05-14 20:45:21,2019-05-14,2019-05-14,2820.1201170000004,2852.540039,2820.1201170000004,2834.409912,2834.409912,3322720000,14.289794999999685,1
Twitter for iPhone,Today marks the one-year anniversary of the opening of the United States Embassy in Jerusalem Israel. Our beautiful embassy stands as a proud reminder of our strong relationship with Israel and of the importance of keeping a promise and standing for the truth.,05-14-2019 16:27:22,28482,130672,2019-05-14 16:27:22,2019-05-14,2019-05-14,2820.1201170000004,2852.540039,2820.1201170000004,2834.409912,2834.409912,3322720000,14.289794999999685,1
Twitter for iPhone,When Prime Minister @AbeShinzo of Japan visited with me in the @WhiteHouse two weeks ago I told him that I would be going to the G20 in Osaka Japan. I look forward to being with him and other World Leaders!,05-14-2019 15:43:19,13496,66411,2019-05-14 15:43:19,2019-05-14,2019-05-14,2820.1201170000004,2852.540039,2820.1201170000004,2834.409912,2834.409912,3322720000,14.289794999999685,1
Twitter for iPhone,Our great Senator (and Star) from the State of Arkansas @TomCottonAR has just completed a wonderful book “Sacred Duty” about Arlington National Cemetery and the men and women who serve with such love and devotion. On sale today make it big!,05-14-2019 14:59:17,11718,51258,2019-05-14 14:59:17,2019-05-14,2019-05-14,2820.1201170000004,2852.540039,2820.1201170000004,2834.409912,2834.409912,3322720000,14.289794999999685,1
Twitter for iPhone,China will be pumping money into their system and probably reducing interest rates as always in order to make up for the business they are and will be losing. If the Federal Reserve ever did a “match” it would be game over we win! In any event China wants a deal!,05-14-2019 12:35:41,17345,72648,2019-05-14 12:35:41,2019-05-14,2019-05-14,2820.1201170000004,2852.540039,2820.1201170000004,2834.409912,2834.409912,3322720000,14.289794999999685,1
Twitter for iPhone,Our great Senator (and Star) from the State of Arkansas @TomCottonAR has just completed a wonderful book “Sacred Duty” about Arlington National Cemetary and the men and women who serve with such love and devotion. On sale today make it big!,05-14-2019 11:39:01,6493,26405,2019-05-14 11:39:01,2019-05-14,2019-05-14,2820.1201170000004,2852.540039,2820.1201170000004,2834.409912,2834.409912,3322720000,14.289794999999685,1
Twitter for iPhone,Our great Patriot Farmers will be one of the biggest beneficiaries of what is happening now. Hopefully China will do us the honor of continuing to buy our great farm product the best but if not your Country will be making up the difference based on a very high China buy......,05-14-2019 11:29:35,15983,78516,2019-05-14 11:29:35,2019-05-14,2019-05-14,2820.1201170000004,2852.540039,2820.1201170000004,2834.409912,2834.409912,3322720000,14.289794999999685,1
Twitter for iPhone,....This money will come from the massive Tariffs being paid to the United States for allowing China and others to do business with us. The Farmers have been “forgotten” for many years. Their time is now!,05-14-2019 11:29:35,13839,68739,2019-05-14 11:29:35,2019-05-14,2019-05-14,2820.1201170000004,2852.540039,2820.1201170000004,2834.409912,2834.409912,3322720000,14.289794999999685,1
Twitter for iPhone,When the time is right we will make a deal with China. My respect and friendship with President Xi is unlimited but as I have told him many times before this must be a great deal for the United States or it just doesn’t make any sense. We have to be allowed to make up some.....,05-14-2019 11:16:58,20338,106984,2019-05-14 11:16:58,2019-05-14,2019-05-14,2820.1201170000004,2852.540039,2820.1201170000004,2834.409912,2834.409912,3322720000,14.289794999999685,1
Twitter for iPhone,....of the tremendous ground we have lost to China on Trade since the ridiculous one sided formation of the WTO. It will all happen and much faster than people think!,05-14-2019 11:16:58,15581,85027,2019-05-14 11:16:58,2019-05-14,2019-05-14,2820.1201170000004,2852.540039,2820.1201170000004,2834.409912,2834.409912,3322720000,14.289794999999685,1
Twitter for iPhone,We can make a deal with China tomorrow before their companies start leaving so as not to lose USA business but the last time we were close they wanted to renegotiate the deal. No way! We are in a much better position now than any deal we could have made. Will be taking in.....,05-14-2019 10:51:41,16104,77483,2019-05-14 10:51:41,2019-05-14,2019-05-14,2820.1201170000004,2852.540039,2820.1201170000004,2834.409912,2834.409912,3322720000,14.289794999999685,1
Twitter for iPhone,Billions of Dollars and moving jobs back to the USA where they belong. Other countries are already negotiating with us because they don’t want this to happen to them. They must be a part of USA action. This should have been done by our leaders many years ago. Enjoy!,05-14-2019 10:51:41,14711,70649,2019-05-14 10:51:41,2019-05-14,2019-05-14,2820.1201170000004,2852.540039,2820.1201170000004,2834.409912,2834.409912,3322720000,14.289794999999685,1
Twitter for iPhone,....so that they will be more competitive for USA buyers. We are now a much bigger economy than China and have substantially increased in size since the great 2016 Election. We are the “piggy bank” that everyone wants to raid and take advantage of. NO MORE!,05-14-2019 10:31:11,14492,71646,2019-05-14 10:31:11,2019-05-14,2019-05-14,2820.1201170000004,2852.540039,2820.1201170000004,2834.409912,2834.409912,3322720000,14.289794999999685,1
Twitter for iPhone,China buys MUCH less from us than we buy from them by almost 500 Billion Dollars so we are in a fantastic position. Make your product at home in the USA and there is no Tariff. You can also buy from a non-Tariffed country instead of China. Many companies are leaving China.....,05-14-2019 10:31:10,19811,93796,2019-05-14 10:31:10,2019-05-14,2019-05-14,2820.1201170000004,2852.540039,2820.1201170000004,2834.409912,2834.409912,3322720000,14.289794999999685,1
Twitter for iPhone,In one year Tariffs have rebuilt our Steel Industry - it is booming! We placed a 25% Tariff on “dumped” steel from China &amp; other countries and we now have a big and growing industry. We had to save Steel for our defense and auto industries both of which are coming back strong!,05-14-2019 10:15:50,18806,80684,2019-05-14 10:15:50,2019-05-14,2019-05-14,2820.1201170000004,2852.540039,2820.1201170000004,2834.409912,2834.409912,3322720000,14.289794999999685,1
Twitter for iPhone,I met Marine Sgt. John Peck a quadruple amputee who has received a double arm transplant at Walter Reed in 2017. Today it was my honor to welcome John (HERO) to the Oval with his wonderful wife Jessica. He also wrote a book that I highly recommend “Rebuilding Sergeant Peck.” https://t.co/eiNnHcEU7x,05-13-2019 23:15:34,21407,97750,2019-05-13 23:15:34,2019-05-13,2019-05-13,2840.189941,2840.189941,2801.429932,2811.8701170000004,2811.8701170000004,3894030000,-28.3198239999997,0
Twitter for iPhone,Wishing former President Jimmy Carter a speedy recovery from his hip surgery earlier today. He was in such good spirits when we spoke last month - he will be fine!,05-13-2019 22:31:22,13509,87358,2019-05-13 22:31:22,2019-05-13,2019-05-13,2840.189941,2840.189941,2801.429932,2811.8701170000004,2811.8701170000004,3894030000,-28.3198239999997,0
Twitter for iPhone,Great to welcome Chairman Shin from Lotte Group to the WH. They just invested $3.1 BILLION into Louisiana-biggest investment in U.S. EVER from a South Korean company &amp; thousands more jobs for Americans. Great partners like ROK know the U.S. economy is running stronger than ever! https://t.co/WaJxDeTuxj,05-13-2019 21:53:28,11904,46975,2019-05-13 21:53:28,2019-05-13,2019-05-13,2840.189941,2840.189941,2801.429932,2811.8701170000004,2811.8701170000004,3894030000,-28.3198239999997,0
Twitter for iPhone,Today I officially updated my budget to include $18 million for our GREAT @SpecialOlympics whose athletes inspire us and make our Nation so PROUD!,05-13-2019 21:41:51,15676,79133,2019-05-13 21:41:51,2019-05-13,2019-05-13,2840.189941,2840.189941,2801.429932,2811.8701170000004,2811.8701170000004,3894030000,-28.3198239999997,0
Twitter for iPhone,We must protect our Great Lakes keeping them clean and beautiful for future generations. That’s why I am fighting for $300 million in my updated budget for the Great Lakes Restoration Initiative.,05-13-2019 21:38:29,17524,82115,2019-05-13 21:38:29,2019-05-13,2019-05-13,2840.189941,2840.189941,2801.429932,2811.8701170000004,2811.8701170000004,3894030000,-28.3198239999997,0
Twitter for iPhone,Under my Administration we are restoring @NASA to greatness and we are going back to the Moon then Mars. I am updating my budget to include an additional $1.6 billion so that we can return to Space in a BIG WAY!,05-13-2019 21:34:50,18510,86763,2019-05-13 21:34:50,2019-05-13,2019-05-13,2840.189941,2840.189941,2801.429932,2811.8701170000004,2811.8701170000004,3894030000,-28.3198239999997,0
Twitter for iPhone,My Administration will be fighting for $200 million for the Army Corps Everglades restoration work this year. Congress needs to help us complete the world’s largest intergovernmental watershed restoration project ASAP! Good for Florida and good for the environment.,05-13-2019 21:32:11,16709,70310,2019-05-13 21:32:11,2019-05-13,2019-05-13,2840.189941,2840.189941,2801.429932,2811.8701170000004,2811.8701170000004,3894030000,-28.3198239999997,0
Twitter for iPhone,..There will be nobody left in China to do business with. Very bad for China very good for USA! But China has taken so advantage of the U.S. for so many years that they are way ahead (Our Presidents did not do the job). Therefore China should not retaliate-will only get worse!,05-13-2019 15:55:23,16702,79611,2019-05-13 15:55:23,2019-05-13,2019-05-13,2840.189941,2840.189941,2801.429932,2811.8701170000004,2811.8701170000004,3894030000,-28.3198239999997,0
Twitter for iPhone,There is no reason for the U.S. Consumer to pay the Tariffs which take effect on China today. This has been proven recently when only 4 points were paid by the U.S. 21 points by China because China subsidizes product to such a large degree. Also the Tariffs can be.....,05-13-2019 15:55:22,18882,88617,2019-05-13 15:55:22,2019-05-13,2019-05-13,2840.189941,2840.189941,2801.429932,2811.8701170000004,2811.8701170000004,3894030000,-28.3198239999997,0
Twitter for iPhone,...completely avoided if you buy from a non-Tariffed Country or you buy the product inside the USA (the best idea). That’s Zero Tariffs. Many Tariffed companies will be leaving China for Vietnam and other such countries in Asia. That’s why China wants to make a deal so badly!...,05-13-2019 15:55:22,14834,73870,2019-05-13 15:55:22,2019-05-13,2019-05-13,2840.189941,2840.189941,2801.429932,2811.8701170000004,2811.8701170000004,3894030000,-28.3198239999997,0
Twitter for iPhone,Democrat Rep. Tlaib is being slammed for her horrible and highly insensitive statement on the Holocaust. She obviously has tremendous hatred of Israel and the Jewish people. Can you imagine what would happen if I ever said what she said and says?,05-13-2019 14:09:18,30274,111506,2019-05-13 14:09:18,2019-05-13,2019-05-13,2840.189941,2840.189941,2801.429932,2811.8701170000004,2811.8701170000004,3894030000,-28.3198239999997,0
Twitter for iPhone,Bernie Sanders “The Economy is doing well and I’m sure I don’t have to give Trump any credit - I’m sure he’ll take all the credit that he wants.” Wrong Bernie the Economy is doing GREAT and would have CRASHED if my opponent (and yours) Crooked Hillary Clinton had ever won!,05-13-2019 13:59:34,22288,93608,2019-05-13 13:59:34,2019-05-13,2019-05-13,2840.189941,2840.189941,2801.429932,2811.8701170000004,2811.8701170000004,3894030000,-28.3198239999997,0
Twitter for iPhone,Has anyone noticed that all the Boston @RedSox have done is WIN since coming to the White House! Others also have done very well. The White House visit is becoming the opposite of being on the cover of Sports Illustrated! By the way the Boston players were GREAT guys!,05-13-2019 11:29:13,12982,64008,2019-05-13 11:29:13,2019-05-13,2019-05-13,2840.189941,2840.189941,2801.429932,2811.8701170000004,2811.8701170000004,3894030000,-28.3198239999997,0
Twitter for iPhone,The unexpectedly good first quarter 3.2% GDP was greatly helped by Tariffs from China. Some people just don’t get it!,05-13-2019 11:02:18,13492,58788,2019-05-13 11:02:18,2019-05-13,2019-05-13,2840.189941,2840.189941,2801.429932,2811.8701170000004,2811.8701170000004,3894030000,-28.3198239999997,0
Twitter for iPhone,Also congratulations to @OANN on the great job you are doing and the big ratings jump (“thank you President Trump”)!,05-13-2019 10:56:22,15522,65025,2019-05-13 10:56:22,2019-05-13,2019-05-13,2840.189941,2840.189941,2801.429932,2811.8701170000004,2811.8701170000004,3894030000,-28.3198239999997,0
Twitter for iPhone,Thank you @foxandfriends great show this morning and congratulations on your number one (by far) rating. Well deserved!,05-13-2019 10:52:30,11297,60037,2019-05-13 10:52:30,2019-05-13,2019-05-13,2840.189941,2840.189941,2801.429932,2811.8701170000004,2811.8701170000004,3894030000,-28.3198239999997,0
Twitter for iPhone,I say openly to President Xi &amp; all of my many friends in China that China will be hurt very badly if you don’t make a deal because companies will be forced to leave China for other countries. Too expensive to buy in China. You had a great deal almost completed &amp; you backed out!,05-13-2019 10:49:24,20711,87350,2019-05-13 10:49:24,2019-05-13,2019-05-13,2840.189941,2840.189941,2801.429932,2811.8701170000004,2811.8701170000004,3894030000,-28.3198239999997,0
Twitter for iPhone,Their is no reason for the U.S. Consumer to pay the Tariffs which take effect on China today. This has been proven recently when only 4 points were paid by the U.S. 21 points by China because China subsidizes product to such a large degree. Also the Tariffs can be.....,05-13-2019 10:40:25,11309,49347,2019-05-13 10:40:25,2019-05-13,2019-05-13,2840.189941,2840.189941,2801.429932,2811.8701170000004,2811.8701170000004,3894030000,-28.3198239999997,0
Twitter for iPhone,....completely avoided if you by from a non-Tariffed Country or you buy the product inside the USA (the best idea). That’s Zero Tariffs. Many Tariffed companies will be leaving China for Vietnam and other such countries in Asia. That’s why China wants to make a deal so badly!...,05-13-2019 10:40:25,10000,45376,2019-05-13 10:40:25,2019-05-13,2019-05-13,2840.189941,2840.189941,2801.429932,2811.8701170000004,2811.8701170000004,3894030000,-28.3198239999997,0
Twitter for iPhone,..There will be nobody left in China to do business with. Very bad for China very good for USA! But China has taken so advantage of the U.S. for so many years that they are way ahead (Our Presidents did not do the job). Therefore China should not retaliate-will only get worse!,05-13-2019 10:40:25,10570,47367,2019-05-13 10:40:25,2019-05-13,2019-05-13,2840.189941,2840.189941,2801.429932,2811.8701170000004,2811.8701170000004,3894030000,-28.3198239999997,0
Twitter for iPhone,“It’s the attack strategy of harass. This is not about the Attorney General who is very sophisticated &amp; knows it isn’t about him it’s about trying to destroy President Trump through an assault on his AG for upholding the rule of law. He released a massive amount of......,05-13-2019 10:09:51,18401,76724,2019-05-13 10:09:51,2019-05-13,2019-05-13,2840.189941,2840.189941,2801.429932,2811.8701170000004,2811.8701170000004,3894030000,-28.3198239999997,0
Twitter for iPhone,information! As long as President Trump is President his opposition will use every tool and misuse every tool available to make his life miserable.” @TomFitton @JudicialWatch @LouDobbs  Sadly this proves I am doing a great job - Also Best Economy and Employment Numbers EVER!,05-13-2019 10:09:51,17036,74962,2019-05-13 10:09:51,2019-05-13,2019-05-13,2840.189941,2840.189941,2801.429932,2811.8701170000004,2811.8701170000004,3894030000,-28.3198239999997,0
Twitter for iPhone,“Just another abuse of power in a long series of abuses of power by the Democrats that began during the Obama Administration continued through the Mueller FBI operation &amp; now the baton has been passed to Jerry Nadler to continue to abuse power to harass President Trump..,05-13-2019 02:00:47,21414,85203,2019-05-13 02:00:47,2019-05-13,2019-05-13,2840.189941,2840.189941,2801.429932,2811.8701170000004,2811.8701170000004,3894030000,-28.3198239999997,0
Twitter for iPhone,....and the Democrat National Committee-The Democrat Party apparatus-has been caught using donor Dollars to Collude with Russian Intelligence to attack a domestic political opponent (me). The FBI has no leadership. The Director is protecting the same gang.....that tried to....,05-13-2019 02:00:47,17100,69661,2019-05-13 02:00:47,2019-05-13,2019-05-13,2840.189941,2840.189941,2801.429932,2811.8701170000004,2811.8701170000004,3894030000,-28.3198239999997,0
Twitter for iPhone,....overthrow the President through an illegal coup.” (Recommended by previous DOJ) @TomFitton @JudicialWatch,05-13-2019 02:00:47,17215,69713,2019-05-13 02:00:47,2019-05-13,2019-05-13,2840.189941,2840.189941,2801.429932,2811.8701170000004,2811.8701170000004,3894030000,-28.3198239999997,0
Twitter for iPhone,“Even Director James Clapper admits that the FBI actions against the Trump Presidential Campaign do in fact meet the definition of spying perhaps FBI Director Christopher Wray will be the next to do so.” @LouDobbs,05-13-2019 01:19:46,17729,64921,2019-05-13 01:19:46,2019-05-13,2019-05-13,2840.189941,2840.189941,2801.429932,2811.8701170000004,2811.8701170000004,3894030000,-28.3198239999997,0
Twitter for iPhone,Military spouses share an admirable legacy of unwavering devotion to their loved ones in uniform and to the cause of freedom. On Military Spouse Day we honor our Nation’s military spouses and express our deep appreciation for all that they do! https://t.co/B3NrKc698y,05-10-2019 21:13:28,15623,60055,2019-05-10 21:13:28,2019-05-10,2019-05-10,2863.100098,2891.310059,2825.389893,2881.399902,2881.399902,3529600000,18.299804000000222,1
Twitter for iPhone,Over the course of the past two days the United States and China have held candid and constructive conversations on the status of the trade relationship between both countries. The relationship between President Xi and myself remains a very strong one and conversations....,05-10-2019 19:14:04,17197,85559,2019-05-10 19:14:04,2019-05-10,2019-05-10,2863.100098,2891.310059,2825.389893,2881.399902,2881.399902,3529600000,18.299804000000222,1
Twitter for iPhone,....into the future will continue. In the meantime the United States has imposed Tariffs on China which may or may not be removed depending on what happens with respect to future negotiations!,05-10-2019 19:14:04,14150,71964,2019-05-10 19:14:04,2019-05-10,2019-05-10,2863.100098,2891.310059,2825.389893,2881.399902,2881.399902,3529600000,18.299804000000222,1
Twitter for iPhone,Great Republican vote today on Disaster Relief Bill. We will now work out a bipartisan solution that gets relief for our great States and Farmers. Thank you to all. Get me a Bill that I can quickly sign!,05-10-2019 17:57:00,16267,73539,2019-05-10 17:57:00,2019-05-10,2019-05-10,2863.100098,2891.310059,2825.389893,2881.399902,2881.399902,3529600000,18.299804000000222,1
Twitter for iPhone,“We have been engaged in an unfair relationship with China for a long time. They have reneged on the commitments they made to the WTO particularly around intellectual property.” Carly Fiorina @MariaBartiromo,05-10-2019 13:39:11,14155,56359,2019-05-10 13:39:11,2019-05-10,2019-05-10,2863.100098,2891.310059,2825.389893,2881.399902,2881.399902,3529600000,18.299804000000222,1
Twitter for iPhone,Looks to me like it’s going to be SleepyCreepy Joe over Crazy Bernie. Everyone else is fading fast!,05-10-2019 13:20:35,19338,91098,2019-05-10 13:20:35,2019-05-10,2019-05-10,2863.100098,2891.310059,2825.389893,2881.399902,2881.399902,3529600000,18.299804000000222,1
Twitter for iPhone,Great Consumer Price Index just out. Really good very low inflation! We have a great chance to “really rock!” Good numbers all around.,05-10-2019 13:01:47,13931,62163,2019-05-10 13:01:47,2019-05-10,2019-05-10,2863.100098,2891.310059,2825.389893,2881.399902,2881.399902,3529600000,18.299804000000222,1
Twitter for iPhone,Your all time favorite President got tired of waiting for China to help out and start buying from our FARMERS the greatest anywhere in the World!,05-10-2019 12:55:27,21806,116035,2019-05-10 12:55:27,2019-05-10,2019-05-10,2863.100098,2891.310059,2825.389893,2881.399902,2881.399902,3529600000,18.299804000000222,1
Twitter for iPhone,Build your products in the United States and there are NO TARIFFS!,05-10-2019 12:08:32,23365,101765,2019-05-10 12:08:32,2019-05-10,2019-05-10,2863.100098,2891.310059,2825.389893,2881.399902,2881.399902,3529600000,18.299804000000222,1
Twitter for iPhone,....If we bought 15 Billion Dollars of Agriculture from our Farmers far more than China buys now we would have more than 85 Billion Dollars left over for new Infrastructure Healthcare or anything else. China would greatly slow down and we would automatically speed up!,05-10-2019 12:07:24,15135,70650,2019-05-10 12:07:24,2019-05-10,2019-05-10,2863.100098,2891.310059,2825.389893,2881.399902,2881.399902,3529600000,18.299804000000222,1
Twitter for iPhone,Build your products in the United States and there are NO TARIFFS!,05-10-2019 12:02:11,1440,5393,2019-05-10 12:02:11,2019-05-10,2019-05-10,2863.100098,2891.310059,2825.389893,2881.399902,2881.399902,3529600000,18.299804000000222,1
Twitter for iPhone,The average 401(k) balance has SOARED since the bottom of the market - 466%. Wow!,05-10-2019 11:54:19,12555,57536,2019-05-10 11:54:19,2019-05-10,2019-05-10,2863.100098,2891.310059,2825.389893,2881.399902,2881.399902,3529600000,18.299804000000222,1
Twitter for iPhone,Tariffs will make our Country MUCH STRONGER not weaker. Just sit back and watch! In the meantime China should not renegotiate deals with the U.S. at the last minute. This is not the Obama Administration or the Administration of Sleepy Joe who let China get away with “murder!”,05-10-2019 11:48:26,16291,62384,2019-05-10 11:48:26,2019-05-10,2019-05-10,2863.100098,2891.310059,2825.389893,2881.399902,2881.399902,3529600000,18.299804000000222,1
Twitter for iPhone,Tariffs will bring in FAR MORE wealth to our Country than even a phenomenal deal of the traditional kind. Also much easier &amp; quicker to do. Our Farmers will do better faster and starving nations can now be helped. Waivers on some products will be granted or go to new source!,05-10-2019 11:46:16,14080,68357,2019-05-10 11:46:16,2019-05-10,2019-05-10,2863.100098,2891.310059,2825.389893,2881.399902,2881.399902,3529600000,18.299804000000222,1
Twitter for iPhone,....The process has begun to place additional Tariffs at 25% on the remaining 325 Billion Dollars. The U.S. only sells China approximately 100 Billion Dollars of goods &amp; products a very big imbalance. With the over 100 Billion Dollars in Tariffs that we take in we will buy.....,05-10-2019 11:43:56,5139,19125,2019-05-10 11:43:56,2019-05-10,2019-05-10,2863.100098,2891.310059,2825.389893,2881.399902,2881.399902,3529600000,18.299804000000222,1
Twitter for iPhone,....agricultural products from our Great Farmers in larger amounts than China ever did and ship it to poor &amp; starving countries in the form of humanitarian assistance. In the meantime we will continue to negotiate with China in the hopes that they do not again try to redo deal!,05-10-2019 11:43:56,6557,25567,2019-05-10 11:43:56,2019-05-10,2019-05-10,2863.100098,2891.310059,2825.389893,2881.399902,2881.399902,3529600000,18.299804000000222,1
Twitter for iPhone,Talks with China continue in a very congenial manner - there is absolutely no need to rush - as Tariffs are NOW being paid to the United States by China of 25% on 250 Billion Dollars worth of goods &amp; products. These massive payments go directly to the Treasury of the U.S....,05-10-2019 11:43:56,18397,89276,2019-05-10 11:43:56,2019-05-10,2019-05-10,2863.100098,2891.310059,2825.389893,2881.399902,2881.399902,3529600000,18.299804000000222,1
Twitter for iPhone,V.P. Mike Pence will be interviewed on @foxandfriends at 7:30 A.M. Enjoy!,05-10-2019 11:27:35,5662,31979,2019-05-10 11:27:35,2019-05-10,2019-05-10,2863.100098,2891.310059,2825.389893,2881.399902,2881.399902,3529600000,18.299804000000222,1
Twitter for iPhone,We have lost 500 Billion Dollars a year for many years on Crazy Trade with China. NO MORE!,05-10-2019 11:24:39,19829,82066,2019-05-10 11:24:39,2019-05-10,2019-05-10,2863.100098,2891.310059,2825.389893,2881.399902,2881.399902,3529600000,18.299804000000222,1
Twitter for iPhone,....The process has begun to place additional Tariffs at 25% on the remaining 325 Billion Dollars. The U.S. only sells China approximately 100 Billion Dollars of goods &amp; products a very big imbalance. With the over 100 Billion Dollars in Tariffs that we take in we will buy.....,05-10-2019 11:22:22,607,1472,2019-05-10 11:22:22,2019-05-10,2019-05-10,2863.100098,2891.310059,2825.389893,2881.399902,2881.399902,3529600000,18.299804000000222,1
Twitter for iPhone,....agricultural products from our Great Farmers in larger amounts than China ever did and ship it to poor &amp; starving countries in the form of humanitarian assistance. In the meantime we will continue to negotiate with China in the hopes that they do not again try to redo deal!,05-10-2019 11:22:22,582,1495,2019-05-10 11:22:22,2019-05-10,2019-05-10,2863.100098,2891.310059,2825.389893,2881.399902,2881.399902,3529600000,18.299804000000222,1
Twitter for iPhone,Tariffs will bring in FAR MORE wealth to our Country than even a phenomenal deal of the traditional kind. Also much easier &amp; quicker to do. Our Farmers will do better faster and starving nations can now be helped. Waivers on some products will be granted or go to new source!,05-10-2019 11:22:22,717,2015,2019-05-10 11:22:22,2019-05-10,2019-05-10,2863.100098,2891.310059,2825.389893,2881.399902,2881.399902,3529600000,18.299804000000222,1
Twitter for iPhone,....If we bought 15 Billion Dollars of Agriculture from our Farmers far more than China buys now we would have more than 85 Billion Dollars left over for new Infrastructure Healthcare or anything else. China would greatly slow down and we would automatically speed up!,05-10-2019 11:22:22,807,2213,2019-05-10 11:22:22,2019-05-10,2019-05-10,2863.100098,2891.310059,2825.389893,2881.399902,2881.399902,3529600000,18.299804000000222,1
Twitter for iPhone,Tariffs will bring in FAR MORE wealth to our Country than even a phenomenal deal of the traditional kind. Also much easier &amp; quicker to do. Our Farmers will do better faster and starving nations can now be helped. Waivers on some products will be granted or go to new source!,05-10-2019 11:22:21,54,171,2019-05-10 11:22:21,2019-05-10,2019-05-10,2863.100098,2891.310059,2825.389893,2881.399902,2881.399902,3529600000,18.299804000000222,1
Twitter for iPhone,....agricultural products from our Great Farmers in larger amounts than China ever did and ship it to poor &amp; starving countries in the form of humanitarian assistance. In the meantime we will continue to negotiate with China in the hopes that they do not again try to redo deal!,05-10-2019 10:53:56,813,2359,2019-05-10 10:53:56,2019-05-10,2019-05-10,2863.100098,2891.310059,2825.389893,2881.399902,2881.399902,3529600000,18.299804000000222,1
Twitter for iPhone,Tariffs will bring in FAR MORE wealth to our country than even a phenomenal deal of the traditional kind. Also much easier &amp; quicker to do. Our Farmers will do better faster and starving nations can now be helped. Waivers on some products will be granted or go to new source!,05-10-2019 10:53:56,1747,7112,2019-05-10 10:53:56,2019-05-10,2019-05-10,2863.100098,2891.310059,2825.389893,2881.399902,2881.399902,3529600000,18.299804000000222,1
Twitter for iPhone,....If we bought 15 Billion Dollars of Agriculture from our Farmers far more than China buys now we would have more than 85 Billion Dollars left over for new Infrastructure Healthcare or anything else. China would greatly slow down and we would automatically speed up!,05-10-2019 10:53:56,2018,7868,2019-05-10 10:53:56,2019-05-10,2019-05-10,2863.100098,2891.310059,2825.389893,2881.399902,2881.399902,3529600000,18.299804000000222,1
Twitter for iPhone,Talks with China continue in a very congenial manner - there is absolutely no need to rush - as Tariffs are NOW being paid to the United States by China of 25% on 250 Billion Dollars worth of goods &amp; products. These massive payments go directly to the Treasury of the U.S.......,05-10-2019 10:53:55,2637,10037,2019-05-10 10:53:55,2019-05-10,2019-05-10,2863.100098,2891.310059,2825.389893,2881.399902,2881.399902,3529600000,18.299804000000222,1
Twitter for iPhone,....The process has begun to place additional Tariffs at 25% on the remaining 325 Billion Dollars. The U.S. only sells China approximately 100 Billion Dollars of goods &amp; products a very big imbalance. With the over 100 Billion Dollars in Tariffs that we take in we will buy.....,05-10-2019 10:53:55,834,2356,2019-05-10 10:53:55,2019-05-10,2019-05-10,2863.100098,2891.310059,2825.389893,2881.399902,2881.399902,3529600000,18.299804000000222,1
Twitter for iPhone,Republicans must stick together! https://t.co/APrvcjpqOp,05-10-2019 03:58:03,16480,64141,2019-05-10 03:58:03,2019-05-10,2019-05-10,2863.100098,2891.310059,2825.389893,2881.399902,2881.399902,3529600000,18.299804000000222,1
Twitter for iPhone,James Comey is a disgrace to the FBI &amp; will go down as the worst Director in its long and once proud history. He brought the FBI down almost all Republicans &amp; Democrats thought he should be FIRED but the FBI will regain greatness because of the great men &amp; women who work there!,05-10-2019 03:00:20,27156,109718,2019-05-10 03:00:20,2019-05-10,2019-05-10,2863.100098,2891.310059,2825.389893,2881.399902,2881.399902,3529600000,18.299804000000222,1
Twitter for iPhone,House Republicans should not vote for the BAD DEMOCRAT Disaster Supplemental Bill which hurts our States Farmers &amp; Border Security. Up for vote tomorrow. We want to do much better than this. All sides keep working and send a good BILL for immediate signing!,05-09-2019 23:11:00,19101,77206,2019-05-09 23:11:00,2019-05-09,2019-05-09,2859.840088,2875.969971,2836.399902,2870.719971,2870.719971,3638820000,10.879883000000063,1
Twitter for iPhone,Today it was my honor to welcome the 2018 World Series Champion Boston @RedSox to the @WhiteHouse! https://t.co/yHAClpttLM,05-09-2019 22:50:19,11426,56218,2019-05-09 22:50:19,2019-05-09,2019-05-09,2859.840088,2875.969971,2836.399902,2870.719971,2870.719971,3638820000,10.879883000000063,1
Twitter for iPhone,Great news today: My Administration just secured a historic donation of HIV prevention drugs from Gilead to help expand access to PrEP for the uninsured and those at risk. Will help us achieve our goal of ending the HIV epidemic in America! https://t.co/wux5QasWgW,05-09-2019 22:34:32,22280,77116,2019-05-09 22:34:32,2019-05-09,2019-05-09,2859.840088,2875.969971,2836.399902,2870.719971,2870.719971,3638820000,10.879883000000063,1
Twitter for iPhone,After a great rally in Panama City Beach Florida - I am returning to Washington D.C. with @SenRickScott and Senator @MarcoRubio discussing the terrible abuses by Maduro. America stands with the GREAT PEOPLE of Venezuela for however long it takes! https://t.co/KcBoNfEibv,05-09-2019 03:18:10,20387,73391,2019-05-09 03:18:10,2019-05-09,2019-05-09,2859.840088,2875.969971,2836.399902,2870.719971,2870.719971,3638820000,10.879883000000063,1
Twitter for iPhone,MAKE AMERICA GREAT AGAIN! https://t.co/gOXXHnHHG5,05-09-2019 03:05:42,22362,101500,2019-05-09 03:05:42,2019-05-09,2019-05-09,2859.840088,2875.969971,2836.399902,2870.719971,2870.719971,3638820000,10.879883000000063,1
Twitter for iPhone,Beautiful evening in Panama City Beach Florida. Thank you! #MAGAhttps://t.co/lNBM9sED2f,05-09-2019 01:51:19,18053,73285,2019-05-09 01:51:19,2019-05-09,2019-05-09,2859.840088,2875.969971,2836.399902,2870.719971,2870.719971,3638820000,10.879883000000063,1
Twitter for iPhone,Big crowds in Panama City Beach Florida. See everyone in 30 minutes! @FoxNews @TuckerCarlson @SeanHannity https://t.co/57tngL1W2i,05-08-2019 23:32:51,12079,50554,2019-05-08 23:32:51,2019-05-08,2019-05-08,2879.610107,2897.959961,2873.280029,2879.419922,2879.419922,3485790000,-0.19018499999992855,0
Twitter for iPhone,Just landed in Panama City Beach Florida for a rally beginning at 8:00 P.M. Eastern. Will be live on @FoxNews! #MAGA @tuckercarlson @seanhannity,05-08-2019 23:13:58,9623,48963,2019-05-08 23:13:58,2019-05-08,2019-05-08,2879.610107,2897.959961,2873.280029,2879.419922,2879.419922,3485790000,-0.19018499999992855,0
Twitter for iPhone,Big announcement today: Drug companies have to come clean about their prices in TV ads. Historic transparency for American patients is here. If drug companies are ashamed of those prices—lower them!,05-08-2019 21:01:36,30435,137338,2019-05-08 21:01:36,2019-05-08,2019-05-08,2879.610107,2897.959961,2873.280029,2879.419922,2879.419922,3485790000,-0.19018499999992855,0
Twitter for iPhone,“The reality is with the Tariffs the economy has grown more rapidly in the United States and much more slowly in China.” Peter Morici Former Chief Economist USITC,05-08-2019 20:58:40,14695,64329,2019-05-08 20:58:40,2019-05-08,2019-05-08,2879.610107,2897.959961,2873.280029,2879.419922,2879.419922,3485790000,-0.19018499999992855,0
Twitter for iPhone,Getting ready to leave for one of my favorite places the Florida Panhandle where we’ve given and are giving billions of $$$ for the devastation caused by Hurricane Michael. Even though the Dems are totally in our way (they don’t want money to go there) we’re getting it done!,05-08-2019 19:30:31,16497,77179,2019-05-08 19:30:31,2019-05-08,2019-05-08,2879.610107,2897.959961,2873.280029,2879.419922,2879.419922,3485790000,-0.19018499999992855,0
Twitter Media Studio,Thank you @NewtGingrich &amp; @FoxandFriends! https://t.co/GYJ7U2k7nn,05-08-2019 17:54:40,12361,46096,2019-05-08 17:54:40,2019-05-08,2019-05-08,2879.610107,2897.959961,2873.280029,2879.419922,2879.419922,3485790000,-0.19018499999992855,0
Twitter for iPhone,Our Nation grieves at the unspeakable violence that took a precious young life and badly injured others in Colorado. God be with the families and thank you to the First Responders for bravely intervening. We are in close contact with Law Enforcement.,05-08-2019 17:42:44,15669,76180,2019-05-08 17:42:44,2019-05-08,2019-05-08,2879.610107,2897.959961,2873.280029,2879.419922,2879.419922,3485790000,-0.19018499999992855,0
Twitter for iPhone,Republicans shouldn’t vote for H.R. 312 a special interest casino Bill backed by Elizabeth (Pocahontas) Warren. It is unfair and doesn’t treat Native Americans equally!,05-08-2019 15:48:06,18480,70273,2019-05-08 15:48:06,2019-05-08,2019-05-08,2879.610107,2897.959961,2873.280029,2879.419922,2879.419922,3485790000,-0.19018499999992855,0
Twitter for iPhone,....in 3 separate locations creating another 450 jobs. I have been working nicely with GM to get this done. Thank you to Mary B your GREAT Governor and Senator Rob Portman. With all the car companies coming back and much more THE USA IS BOOMING!,05-08-2019 15:18:42,18751,98402,2019-05-08 15:18:42,2019-05-08,2019-05-08,2879.610107,2897.959961,2873.280029,2879.419922,2879.419922,3485790000,-0.19018499999992855,0
Twitter for iPhone,GREAT NEWS FOR OHIO! Just spoke to Mary Barra CEO of General Motors who informed me that subject to a UAW agreement etc. GM will be selling their beautiful Lordstown Plant to Workhorse where they plan to build Electric Trucks. GM will also be spending $700000000 in Ohio...,05-08-2019 15:18:41,26387,127185,2019-05-08 15:18:41,2019-05-08,2019-05-08,2879.610107,2897.959961,2873.280029,2879.419922,2879.419922,3485790000,-0.19018499999992855,0
Twitter for iPhone,“This British Spy Christopher Steele tried so hard to get this (the Fake Dossier) out before the Election. Why?”  @kilmeade @foxandfriends,05-08-2019 14:42:26,13475,49214,2019-05-08 14:42:26,2019-05-08,2019-05-08,2879.610107,2897.959961,2873.280029,2879.419922,2879.419922,3485790000,-0.19018499999992855,0
Twitter for iPhone,“Everyone wants to know who needs to be accountable because it took up two years of our lives talking about this Russian involvement. It proved No Collusion &amp; people want to trace it back to see how this all happened?” @ainsleyearhardt @foxandfriends  TREASONOUS HOAX!,05-08-2019 14:38:49,16831,60072,2019-05-08 14:38:49,2019-05-08,2019-05-08,2879.610107,2897.959961,2873.280029,2879.419922,2879.419922,3485790000,-0.19018499999992855,0
Twitter for iPhone,Big Court win at our Southern Border! We are getting there - and Wall is being built!,05-08-2019 13:42:36,21606,95577,2019-05-08 13:42:36,2019-05-08,2019-05-08,2879.610107,2897.959961,2873.280029,2879.419922,2879.419922,3485790000,-0.19018499999992855,0
Twitter for iPhone,“Shouldn’t 2015 and 2016 be revealed how Intelligence Agencies FBI tried to sabotage a particular campaign - never been done before?” @SteveForbesCEO @MariaBartiromo,05-08-2019 13:23:07,14720,54013,2019-05-08 13:23:07,2019-05-08,2019-05-08,2879.610107,2897.959961,2873.280029,2879.419922,2879.419922,3485790000,-0.19018499999992855,0
Twitter for iPhone,“The real “Obstruction of Justice” is what the Democrats are trying to do to this Attorney General.” Congressman Jim Jordan (R-Ohio). @MariaBartiromo,05-08-2019 12:57:35,18635,69038,2019-05-08 12:57:35,2019-05-08,2019-05-08,2879.610107,2897.959961,2873.280029,2879.419922,2879.419922,3485790000,-0.19018499999992855,0
Twitter for iPhone,....Guess what that’s not going to happen! China has just informed us that they (Vice-Premier) are now coming to the U.S. to make a deal. We’ll see but I am very happy with over $100 Billion a year in Tariffs filling U.S. coffers...great for U.S. not good for China!,05-08-2019 12:48:16,17776,78953,2019-05-08 12:48:16,2019-05-08,2019-05-08,2879.610107,2897.959961,2873.280029,2879.419922,2879.419922,3485790000,-0.19018499999992855,0
Twitter for iPhone,The reason for the China pullback &amp; attempted renegotiation of the Trade Deal is the sincere HOPE that they will be able to “negotiate” with Joe Biden or one of the very weak Democrats and thereby continue to ripoff the United States (($500 Billion a year)) for years to come....,05-08-2019 12:48:15,20947,85311,2019-05-08 12:48:15,2019-05-08,2019-05-08,2879.610107,2897.959961,2873.280029,2879.419922,2879.419922,3485790000,-0.19018499999992855,0
Twitter for iPhone,Real estate developers in the 1980’s &amp; 1990’s more than 30 years ago were entitled to massive write offs and depreciation which would if one was actively building show losses and tax losses in almost all cases. Much was non monetary. Sometimes considered “tax shelter” ......,05-08-2019 10:56:32,19259,93719,2019-05-08 10:56:32,2019-05-08,2019-05-08,2879.610107,2897.959961,2873.280029,2879.419922,2879.419922,3485790000,-0.19018499999992855,0
Twitter for iPhone,....you would get it by building or even buying. You always wanted to show losses for tax purposes....almost all real estate developers did - and often re-negotiate with banks it was sport. Additionally the very old information put out is a highly inaccurate Fake News hit job!,05-08-2019 10:56:32,16812,84592,2019-05-08 10:56:32,2019-05-08,2019-05-08,2879.610107,2897.959961,2873.280029,2879.419922,2879.419922,3485790000,-0.19018499999992855,0
Twitter for iPhone,“CASE CLOSED!” @SenateMajLDR https://t.co/TOIatsmu4U,05-08-2019 10:17:21,18491,69656,2019-05-08 10:17:21,2019-05-08,2019-05-08,2879.610107,2897.959961,2873.280029,2879.419922,2879.419922,3485790000,-0.19018499999992855,0
